{
  "doc_id": "01_2022_TT_BGTVT",
  "meta": {
    "url": "https://thuvienphapluat.vn/van-ban/Giao-thong-Van-tai/Thong-tu-01-2022-TT-BGTVT-sua-doi-Thong-tu-18-2019-TT-BGTVT-dich-vu-kiem-dinh-xe-co-gioi-500515.aspx",
    "crawl_time": "2025-10-15T12:20:57.923252",
    "number": "01/2022/TT-BGTVT",
    "field": "Giao thông",
    "issue_date": "12/01/2022",
    "agency": "BỘ GIAO THÔNG VẬN",
    "content": "BỘ GIAO THÔNG VẬN\r\n  TẢI ------- CỘNG HÒA XÃ HỘI\r\n  CHỦ NGHĨA VIỆT NAM Độc lập - Tự do - Hạnh phúc --------------- Số:\r\n  01/2022/TT-BGTVT Hà Nội, ngày 12\r\n  tháng 01 năm 2022 THÔNG TƯ SỬA ĐỔI, BỔ SUNG MỘT SỐ ĐIỀU THÔNG TƯ SỐ 29/2018/TT-BGTVT NGÀY\r\n14 THÁNG 5 NĂM 2018 CỦA BỘ TRƯỞNG BỘ GIAO THÔNG VẬN TẢI QUY ĐỊNH VỀ KIỂM TRA CHẤT\r\nLƯỢNG, AN TOÀN KỸ THUẬT VÀ BẢO VỆ MÔI TRƯỜNG PHƯƠNG TIỆN GIAO THÔNG ĐƯỜNG SẮT\r\nVÀ THÔNG TƯ SỐ 18/2019/TT-BGTVT NGÀY 20 THÁNG 5 NĂM 2019 CỦA BỘ TRƯỞNG BỘ GIAO\r\nTHÔNG VẬN TẢI HƯỚNG DẪN THỰC HIỆN NGHỊ ĐỊNH SỐ 139/2018/NĐ-CP NGÀY 08 THÁNG 10\r\nNĂM 2018 CỦA CHÍNH PHỦ QUY ĐỊNH VỀ KINH DOANH DỊCH VỤ KIỂM ĐỊNH XE CƠ GIỚI Căn cứ Luật Giao thông đường bộ ngày 13 tháng 11 năm\r\n2008; Căn cứ Luật Đường sắt ngày 16 tháng 6 năm 2017; Căn cứ Nghị định số 139/2018/NĐ-CP ngày 08 tháng 10 năm 2018 của Chính phủ quy định về kinh doanh dịch\r\nvụ kiểm định xe cơ giới; Căn cứ Nghị định số 65/2018/NĐ-CP ngày 12 tháng 5 năm 2018 của Chính phủ Quy định chi tiết thi hành\r\nmột số điều của Luật Đường sắt; Căn cứ Nghị định số 01/2022/NĐ-CP ngày 04 tháng 01 năm 2022 của Chính phủ sửa đổi, bổ sung một số\r\nđiều của Nghị định số 65/2018/NĐ-CP ngày 12 tháng 5 năm 2018 của Chính phủ quy\r\nđịnh chi tiết thi hành một số điều của Luật Đường sắt; Căn cứ Nghị định số 12/2017/NĐ-CP ngày 10 tháng 02 năm 2017 của Chính phủ quy định chức năng, nhiệm vụ, quyền hạn\r\nvà cơ cấu tổ chức của Bộ Giao thông vận tải; Theo đề nghị của Vụ trưởng Vụ\r\nKhoa học - Công nghệ và Cục trưởng Cục Đăng kiểm Việt Nam, Bộ trưởng Bộ Giao thông vận tải\r\nban hành Thông tư sửa đổi, bổ sung một số điều Thông tư số 29/2018/TT-BGTVT ngày 14 tháng 5 năm 2018 của Bộ trưởng Bộ Giao thông vận tải quy định về kiểm\r\ntra chất lượng, an toàn kỹ thuật và bảo vệ môi trường phương tiện giao thông đường\r\nsắt và Thông tư số 18/2019/TT-BGTVT ngày 20 tháng 5 năm 2019 của Bộ trưởng Bộ\r\nGiao thông vận tải hướng dẫn thực hiện Nghị định số 139/2018/NĐ-CP ngày 08\r\ntháng 10 năm 2018 của Chính phủ quy định về kinh doanh dịch vụ kiểm định xe cơ\r\ngiới. Điều 1. Sửa\r\nđổi, bổ sung một số điều Thông tư số 29/2018/TT- BGTVT ngày 14 tháng 5 năm 2018\r\ncủa Bộ trưởng Bộ Giao thông vận tải quy định về việc kiểm tra chất lượng, an\r\ntoàn kỹ thuật và bảo vệ môi trường phương tiện giao thông đường sắt (sau đây gọi\r\ntắt là Thông tư số 29/2018/TT-BGTVT) như sau: 1. Khoản 4 Điều\r\n3 được sửa đổi như sau: “4. Phương tiện chuyên dùng di\r\nchuyển trên đường sắt là phương tiện dùng để vận chuyển người, vật tư, thiết bị\r\nphục vụ cho các mục đích: cứu viện; cứu hộ tai nạn giao thông đường sắt; kiểm\r\ntra, thi công, bảo trì, sửa chữa công trình đường sắt.” 2. Phụ lục VI của Thông tư số 29/2018/TT-BGTVT được sửa đổi, bổ sung theo quy định tại Phụ lục kèm theo Thông\r\ntư này. Điều 2. Bổ\r\nsung Điều 16a Thông tư số 18/2019/TT-BGTVT ngày 20 tháng 5 năm 2019 hướng dẫn\r\nthực hiện Nghị định số 139/2018/NĐ-CP ngày 08 tháng 10 năm 2018 của Chính phủ\r\nquy định về kinh doanh dịch vụ kiểm định xe cơ giới như sau: “Điều 16a. Trách nhiệm của Sở\r\nGiao thông vận tải: Phối hợp với Cục Đăng kiểm Việt\r\nNam trong công tác kiểm tra đánh giá lần đầu các đơn vị đăng kiểm xe cơ giới.” Điều 3. Điều\r\nkhoản thi hành 1. Thông tư này có hiệu lực thi\r\nhành kể từ ngày 01 tháng 3 năm 2022. 2. Bãi bỏ khoản\r\n11 Điều 1 Thông tư số 32/2020/TT-BGTVT ngày 14 tháng 12 năm 2020 của Bộ trưởng\r\nBộ Giao thông vận tải về sửa đổi, bổ sung một số điều của Thông tư số 29/2018/TT-BGTVT ngày 14 tháng 5 năm 2018 quy định về việc kiểm tra chất lượng,\r\nan toàn kỹ thuật và bảo vệ môi trường phương tiện giao thông đường sắt và Thông\r\ntư số 31/2018/TT-BGTVT ngày 15 tháng 5 năm 2018 quy định về thực hiện đánh giá,\r\nchứng nhận an toàn hệ thống đối với đường sắt đô thị. Điều 4. Tổ\r\nchức thực hiện Chánh Văn phòng Bộ, Chánh Thanh\r\ntra Bộ, Vụ trưởng các Vụ, Cục trưởng các Cục: Đăng kiểm Việt Nam, Đường sắt Việt\r\nNam, Giám đốc Sở Giao thông vận tải các tỉnh, thành phố trực thuộc Trung ương,\r\nGiám đốc Sở Giao thông vận tải - Xây dựng Lào Cai, Thủ trưởng các cơ quan, đơn\r\nvị và cá nhân có liên quan chịu trách nhiệm thi hành Thông tư này./. Nơi nhận: - Như Điều 4; - Văn phòng Chính phủ; - Các Bộ, cơ quan ngang Bộ, Cơ quan thuộc Chính phủ; - Bộ trưởng, các Thứ trưởng Bộ GTVT; - UBND các tỉnh, thành phố trực thuộc TW; - Cục Kiểm tra văn bản (Bộ Tư pháp); - Cục KSTTHC (VPCP); - Công báo; - Cổng Thông tin điện tử Chính phủ; - Cổng Thông tin điện tử Bộ GTVT; - Báo Giao thông; Tạp chí GTVT; - Lưu: VT, KHCN. KT. BỘ TRƯỞNG THỨ TRƯỞNG Nguyễn Ngọc Đông PHỤ LỤC (Ban\r\nhành kèm theo Thông tư số 01/2022/TT-BGTVT ngày 12 tháng 01 năm 2022 của Bộ trưởng\r\nBộ Giao thông vận tải) Phụ lục VI CHU KỲ KIỂM TRA Loại phương tiện Chu kỳ kiểm tra (tháng) Chu kỳ đầu Chu kỳ định kỳ 1. Đường sắt quốc gia 1.1. Phương tiện nhập khẩu mới\r\n  và sản xuất, lắp ráp a) Đầu máy, phương tiện\r\n  chuyên dùng có động cơ 18 - b) Toa xe khách 28 - c) Toa xe hàng, phương tiện\r\n  chuyên dùng không có động cơ 36 - 1.2. Phương tiện đang khai\r\n  thác có thời gian sử dụng dưới hoặc bằng 30 năm a) Đầu máy, phương tiện\r\n  chu"
  },
  "structure": {
    "articles": [
      {
        "article": "Điều 1",
        "title": "Sửa",
        "clauses": [
          {
            "no": "1",
            "text": "đổi, bổ sung một số điều Thông tư số 29/2018/TT- BGTVT ngày 14 tháng 5 năm 2018 của Bộ trưởng Bộ Giao thông vận tải quy định về việc kiểm tra chất lượng, an toàn kỹ thuật và bảo vệ môi trường phương tiện giao thông đường sắt (sau đây gọi tắt là Thông tư số 29/2018/TT-BGTVT) như sau: 1. Khoản 4",
            "points": []
          }
        ]
      },
      {
        "article": "Điều 3",
        "title": "được sửa đổi như sau: “4. Phương tiện chuyên dùng di",
        "clauses": [
          {
            "no": "1",
            "text": "chuyển trên đường sắt là phương tiện dùng để vận chuyển người, vật tư, thiết bị phục vụ cho các mục đích: cứu viện; cứu hộ tai nạn giao thông đường sắt; kiểm tra, thi công, bảo trì, sửa chữa công trình đường sắt.” 2. Phụ lục VI của Thông tư số 29/2018/TT-BGTVT được sửa đổi, bổ sung theo quy định tại Phụ lục kèm theo Thông tư này.",
            "points": []
          }
        ]
      },
      {
        "article": "Điều 2",
        "title": "Bổ",
        "clauses": [
          {
            "no": "1",
            "text": "sung",
            "points": []
          }
        ]
      },
      {
        "article": "Điều 16a",
        "title": "Thông tư số 18/2019/TT-BGTVT ngày 20 tháng 5 năm 2019 hướng dẫn",
        "clauses": [
          {
            "no": "1",
            "text": "thực hiện Nghị định số 139/2018/NĐ-CP ngày 08 tháng 10 năm 2018 của Chính phủ quy định về kinh doanh dịch vụ kiểm định xe cơ giới như sau: “",
            "points": []
          }
        ]
      },
      {
        "article": "Điều 16a",
        "title": "Trách nhiệm của Sở",
        "clauses": [
          {
            "no": "1",
            "text": "Giao thông vận tải: Phối hợp với Cục Đăng kiểm Việt Nam trong công tác kiểm tra đánh giá lần đầu các đơn vị đăng kiểm xe cơ giới.”",
            "points": []
          }
        ]
      },
      {
        "article": "Điều 3",
        "title": "Điều",
        "clauses": [
          {
            "no": "1",
            "text": "khoản thi hành 1. Thông tư này có hiệu lực thi hành kể từ ngày 01 tháng 3 năm 2022. 2. Bãi bỏ khoản 11",
            "points": []
          }
        ]
      },
      {
        "article": "Điều 1",
        "title": "Thông tư số 32/2020/TT-BGTVT ngày 14 tháng 12 năm 2020 của Bộ trưởng",
        "clauses": [
          {
            "no": "1",
            "text": "Bộ Giao thông vận tải về sửa đổi, bổ sung một số điều của Thông tư số 29/2018/TT-BGTVT ngày 14 tháng 5 năm 2018 quy định về việc kiểm tra chất lượng, an toàn kỹ thuật và bảo vệ môi trường phương tiện giao thông đường sắt và Thông tư số 31/2018/TT-BGTVT ngày 15 tháng 5 năm 2018 quy định về thực hiện đánh giá, chứng nhận an toàn hệ thống đối với đường sắt đô thị.",
            "points": []
          }
        ]
      },
      {
        "article": "Điều 4",
        "title": "Tổ",
        "clauses": [
          {
            "no": "1",
            "text": "chức thực hiện Chánh Văn phòng Bộ, Chánh Thanh tra Bộ, Vụ trưởng các Vụ, Cục trưởng các Cục: Đăng kiểm Việt Nam, Đường sắt Việt Nam, Giám đốc Sở Giao thông vận tải các tỉnh, thành phố trực thuộc Trung ương, Giám đốc Sở Giao thông vận tải - Xây dựng Lào Cai, Thủ trưởng các cơ quan, đơn vị và cá nhân có liên quan chịu trách nhiệm thi hành Thông tư này./. Nơi nhận: - Như",
            "points": []
          }
        ]
      },
      {
        "article": "Điều 4",
        "title": "; - Văn phòng Chính phủ; - Các Bộ, cơ quan ngang Bộ, Cơ quan thuộc Chính phủ; - Bộ trưởng, các Thứ trưởng Bộ GTVT; - UBND các tỉnh, thành phố trực thuộc TW; - Cục Kiểm tra văn bản (Bộ Tư pháp); - Cục KSTTHC (VPCP); - Công báo; - Cổng Thông tin điện tử Chính phủ; - Cổng Thông tin điện tử Bộ GTVT; - Báo Giao thông; Tạp chí GTVT; - Lưu: VT, KHCN. KT. BỘ TRƯỞNG THỨ TRƯỞNG Nguyễn Ngọc Đông PHỤ LỤC (Ban",
        "clauses": [
          {
            "no": "1",
            "text": "hành kèm theo Thông tư số 01/2022/TT-BGTVT ngày 12 tháng 01 năm 2022 của Bộ trưởng Bộ Giao thông vận tải) Phụ lục VI CHU KỲ KIỂM TRA Loại phương tiện Chu kỳ kiểm tra (tháng) Chu kỳ đầu Chu kỳ định kỳ 1. Đường sắt quốc gia 1.1. Phương tiện nhập khẩu mới và sản xuất, lắp ráp a) Đầu máy, phương tiện chuyên dùng có động cơ 18 - b) Toa xe khách 28 - c) Toa xe hàng, phương tiện chuyên dùng không có động cơ 36 - 1.2. Phương tiện đang khai thác có thời gian sử dụng dưới hoặc bằng 30 năm a) Đầu máy, phương tiện chu",
            "points": []
          }
        ]
      }
    ],
    "strategy_used": "dieu",
    "validation": {
      "status": "warning",
      "issues": [
        "Low content preservation: 45.48%"
      ],
      "stats": {
        "original_length": 4936,
        "segmented_length": 2245,
        "preservation_ratio": 0.45482171799027554,
        "total_articles": 9,
        "total_clauses": 9,
        "total_points": 0
      }
    },
    "document_type": "law"
  }
}