{
  "doc_id": "05_2023_TT_BGTVT",
  "meta": {
    "url": "https://thuvienphapluat.vn/van-ban/Giao-thong-Van-tai/Thong-tu-05-2023-TT-BGTVT-sua-doi-Thong-tu-dich-vu-ho-tro-van-tai-duong-bo-phuong-tien-nguoi-lai-564826.aspx",
    "crawl_time": "2025-10-15T12:30:30.668288",
    "number": "05/2023/TT-BGTVT",
    "field": "Giao thông",
    "issue_date": "27/04/2023",
    "agency": "BỘ, DỊCH VỤ HỖ TRỢ VẬN TẢI ĐƯỜNG BỘ, PHƯƠNG TIỆN",
    "content": "BỘ GIAO\r\n  THÔNG VẬN TẢI -------- CỘNG HÒA XÃ\r\n  HỘI CHỦ NGHĨA VIỆT NAM Độc lập - Tự do - Hạnh phúc --------------- Số:\r\n  05/2023/TT-BGTVT Hà Nội, ngày\r\n  27 tháng 04 năm 2023 THÔNG TƯ SỬA ĐỔI, BỔ SUNG MỘT SỐ ĐIỀU CỦA CÁC THÔNG TƯ LIÊN\r\nQUAN ĐẾN LĨNH VỰC VẬN TẢI ĐƯỜNG BỘ, DỊCH VỤ HỖ TRỢ VẬN TẢI ĐƯỜNG BỘ, PHƯƠNG TIỆN\r\nVÀ NGƯỜI LÁI Căn cứ Luật Giao thông đường bộ ngày 13 tháng 11 năm\r\n2008; Căn cứ Luật Đầu tư ngày 17 tháng 6 năm 2020; Căn cứ Nghị định số 56/2022/NĐ-CP ngày 24 tháng 8 năm\r\n2022 của Chính phủ quy định chức năng, nhiệm vụ, quyền hạn và cơ cấu tổ chức của\r\nBộ Giao thông vận tải; Căn cứ Nghị định số 65/2016/NĐ-CP ngày 01 tháng 7 năm\r\n2016 của Chính phủ quy định về điều kiện kinh doanh dịch vụ đào tạo lái xe ô tô\r\nvà dịch vụ sát hạch lái xe; Căn cứ Nghị định số 138/2016/NĐ-CP ngày 08 tháng 10 năm\r\n2018 của Chính phủ sửa đổi, bổ sung một số điều của Nghị định số 65/2016/NĐ-CP ngày 01 tháng 7 năm 2016 của Chính phủ quy định về điều kiện kinh doanh dịch vụ\r\nđào tạo lái xe ô tô và dịch vụ sát hạch lái xe; Căn cứ Nghị định số 70/2022/NĐ-CP ngày 27 tháng 9 năm\r\n2022 của Chính phủ sửa đổi, bổ sung một số điều của các Nghị định quy định liên\r\nquan đến hoạt động kinh doanh trong lĩnh vực đường bộ; Căn cứ Nghị định số 10/2020/NĐ-CP ngày 17 tháng 01 năm\r\n2020 của Chính phủ quy định về kinh doanh và điều kiện kinh doanh vận tải bằng\r\nxe ô tô; Căn cứ Nghị định số 47/2022/NĐ-CP ngày 19 tháng 7 năm\r\n2022 của Chính phủ sửa đổi, bổ sung một số điều của Nghị định số 10/2020/NĐ-CP ngày 17 tháng 01 năm 2020 của Chính phủ quy định về kinh doanh và điều kiện\r\nkinh doanh vận tải bằng xe ô tô; Theo đề nghị của Vụ trưởng\r\nVụ Vận tải và Cục trưởng Cục Đường bộ Việt Nam; Bộ trưởng Bộ Giao thông vận\r\ntải ban hành Thông tư sửa đổi, bổ sung một số điều của các Thông tư liên quan đến\r\nlĩnh vực vận tải đường bộ, dịch vụ hỗ trợ vận tải đường bộ, phương tiện và người\r\nlái. Điều 1.\r\nSửa đổi, bổ sung một số điều của Thông tư số 29/2009/TT- BGTVT ngày 17 tháng 11 năm 2009 của Bộ trưởng Bộ Giao thông vận tải\r\nhướng dẫn thực hiện một số điều của Hiệp định tạo điều kiện thuận lợi vận tải\r\nngười và hàng hóa qua lại biên giới giữa các nước tiểu vùng Mê Công mở rộng (đã\r\nđược sửa đổi, bổ sung tại Thông tư số 89/2014/TT-BGTVT ngày 31 tháng 12 năm 2014) 1. Thay thế cụm từ “Tổng cục\r\nĐường bộ Việt Nam” bằng cụm từ “Cục Đường bộ Việt Nam” tại Điều\r\n11 Thông tư số 29/2009/TT-BGTVT (được sửa đổi, bổ sung tại khoản\r\n5 Điều 1 Thông tư số 89/2014/TT-BGTVT ). Điều 2.\r\nSửa đổi, bổ sung một số điều của Thông tư số 06/2011/TT- BGTVT ngày 07 tháng 3 năm 2011 của Bộ trưởng Bộ Giao thông vận tải\r\nquy định về bồi dưỡng kiến thức pháp luật về giao thông đường bộ cho người điều\r\nkhiển xe máy chuyên dùng tham gia giao thông đường bộ 1. Thay thế cụm từ “Tổng cục\r\nĐường bộ Việt Nam” bằng cụm từ “Cục Đường bộ Việt Nam” tại Điều\r\n12; khoản 5 Điều 13 ; Phụ lục 9 ; Phụ lục 10 . 2. Thay thế cụm từ “Tổng Cục\r\ntrưởng Tổng cục Đường bộ Việt Nam” bằng cụm từ “Cục trưởng Cục Đường bộ Việt\r\nNam” tại Điều 15 . Điều 3.\r\nSửa đổi, bổ sung một số điều của Thông tư số 23/2012/TT- BGTVT ngày 29 tháng 6 năm 2012 của Bộ trưởng Bộ Giao thông vận tải\r\nhướng dẫn thực hiện Hiệp định, Nghị định thư về vận tải đường bộ giữa Chính\r\nphủ nước Cộng hòa xã hội chủ nghĩa Việt Nam và Chính phủ nước Cộng hòa nhân dân\r\nTrung Hoa (đã được sửa đổi, bổ sung tại Thông tư\r\nsố 29/2020/TT-BGTVT ngày 30 tháng 10 năm 2020) 1. Thay thế cụm từ “Tổng cục\r\nĐường bộ Việt Nam” bằng cụm từ “Cục Đường bộ Việt Nam” tại: a) Điều 18,\r\nkhoản 2 Điều 22 Thông tư số 23/2012/TT-BGTVT ; b) Điều 20 của\r\nThông tư số 23/2012/TT-BGTVT (được sửa đổi, bổ sung khoản 8\r\nĐiều 1 Thông tư số 29/2020/TT-BGTVT ). 2. Thay thế cụm từ “Tổng Cục\r\ntrưởng Tổng cục Đường bộ Việt Nam” bằng cụm từ “Cục trưởng Cục Đường bộ Việt\r\nNam” tại Điều 22 Thông tư số 23/2012/TT-BGTVT . Điều 4.\r\nSửa đổi, bổ sung một số điều của Thông tư số 07/2013/TT- BGTVT ngày 03 tháng 5 năm 2013 của Bộ trưởng Bộ Giao thông vận tải\r\nquy định về quản lý, vận hành và khai thác hệ thống thông tin giấy phép lái xe 1. Thay thế cụm từ “Tổng cục\r\nĐường bộ Việt Nam” bằng cụm từ “Cục Đường bộ Việt Nam” tại khoản\r\n1 Điều 4; tên Điều 5; khoản 3 Điều 5 ; khoản 6 Điều 6; khoản\r\n2 Điều 7; Điều 9 ; các khoản 3, khoản 6 và khoản 8 Điều 11 ; khoản 1 Điều 12; khoản 3 Điều 14; Điều 17 . 2. Thay thế cụm từ “Tổng Cục\r\ntrưởng Tổng cục Đường bộ Việt Nam” bằng cụm từ “Cục trưởng Cục Đường bộ Việt\r\nNam” tại khoản 1 Điều 19 . 3. Thay thế cụm từ “Vụ Quản\r\nlý phương tiện và Người lái” bằng cụm từ “Phòng Quản lý Vận tải, phương tiện và\r\nNgười lái” tại khoản 1 Điều 4 . Điều 5.\r\nSửa đổi, bổ sung một số điều của Thông tư số 35/2013/TT- BGTVT ngày 21 tháng 10 năm 2013 của Bộ trưởng Bộ Giao thông vận tải\r\nquy định về xếp hàng hóa trên xe ô tô khi tham gia giao thông trên đường bộ 1. Thay thế cụm từ “Tổng cục\r\nĐường bộ Việt Nam” bằng cụm từ “Cục Đường bộ Việt Nam” tại Điều\r\n12 . 2. Thay thế cụm từ “Tổng Cục\r\ntrưởng Tổng cục Đường bộ Việt Nam” bằng cụm từ “Cục trưởng Cục Đường bộ Việt\r\nNam” tại Điều 15 ."
  },
  "structure": {
    "articles": [
      {
        "article": "Điều 1",
        "title": "Sửa đổi, bổ sung một số điều của Thông tư số 29/2009/TT- BGTVT ngày 17 tháng 11 năm 2009 của Bộ trưởng Bộ Giao thông vận tải",
        "clauses": [
          {
            "no": "1",
            "text": "hướng dẫn thực hiện một số điều của Hiệp định tạo điều kiện thuận lợi vận tải người và hàng hóa qua lại biên giới giữa các nước tiểu vùng Mê Công mở rộng (đã được sửa đổi, bổ sung tại Thông tư số 89/2014/TT-BGTVT ngày 31 tháng 12 năm 2014) 1. Thay thế cụm từ “Tổng cục Đường bộ Việt Nam” bằng cụm từ “Cục Đường bộ Việt Nam” tại",
            "points": []
          }
        ]
      },
      {
        "article": "Điều 11",
        "title": "Thông tư số 29/2009/TT-BGTVT (được sửa đổi, bổ sung tại khoản",
        "clauses": [
          {
            "no": "1",
            "text": "5",
            "points": []
          }
        ]
      },
      {
        "article": "Điều 1",
        "title": "Thông tư số 89/2014/TT-BGTVT ).",
        "clauses": []
      },
      {
        "article": "Điều 2",
        "title": "Sửa đổi, bổ sung một số điều của Thông tư số 06/2011/TT- BGTVT ngày 07 tháng 3 năm 2011 của Bộ trưởng Bộ Giao thông vận tải",
        "clauses": [
          {
            "no": "1",
            "text": "quy định về bồi dưỡng kiến thức pháp luật về giao thông đường bộ cho người điều khiển xe máy chuyên dùng tham gia giao thông đường bộ 1. Thay thế cụm từ “Tổng cục Đường bộ Việt Nam” bằng cụm từ “Cục Đường bộ Việt Nam” tại",
            "points": []
          }
        ]
      },
      {
        "article": "Điều 12",
        "title": "; khoản 5",
        "clauses": []
      },
      {
        "article": "Điều 13",
        "title": "; Phụ lục 9 ; Phụ lục 10 . 2. Thay thế cụm từ “Tổng Cục",
        "clauses": [
          {
            "no": "1",
            "text": "trưởng Tổng cục Đường bộ Việt Nam” bằng cụm từ “Cục trưởng Cục Đường bộ Việt Nam” tại",
            "points": []
          }
        ]
      },
      {
        "article": "Điều 15",
        "title": "",
        "clauses": []
      },
      {
        "article": "Điều 3",
        "title": "Sửa đổi, bổ sung một số điều của Thông tư số 23/2012/TT- BGTVT ngày 29 tháng 6 năm 2012 của Bộ trưởng Bộ Giao thông vận tải",
        "clauses": [
          {
            "no": "1",
            "text": "hướng dẫn thực hiện Hiệp định, Nghị định thư về vận tải đường bộ giữa Chính phủ nước Cộng hòa xã hội chủ nghĩa Việt Nam và Chính phủ nước Cộng hòa nhân dân Trung Hoa (đã được sửa đổi, bổ sung tại Thông tư số 29/2020/TT-BGTVT ngày 30 tháng 10 năm 2020) 1. Thay thế cụm từ “Tổng cục Đường bộ Việt Nam” bằng cụm từ “Cục Đường bộ Việt Nam” tại: a)",
            "points": []
          }
        ]
      },
      {
        "article": "Điều 18",
        "title": ",",
        "clauses": [
          {
            "no": "1",
            "text": "khoản 2",
            "points": []
          }
        ]
      },
      {
        "article": "Điều 22",
        "title": "Thông tư số 23/2012/TT-BGTVT ; b)",
        "clauses": []
      },
      {
        "article": "Điều 20",
        "title": "của",
        "clauses": [
          {
            "no": "1",
            "text": "Thông tư số 23/2012/TT-BGTVT (được sửa đổi, bổ sung khoản 8",
            "points": []
          }
        ]
      },
      {
        "article": "Điều 1",
        "title": "Thông tư số 29/2020/TT-BGTVT ). 2. Thay thế cụm từ “Tổng Cục",
        "clauses": [
          {
            "no": "1",
            "text": "trưởng Tổng cục Đường bộ Việt Nam” bằng cụm từ “Cục trưởng Cục Đường bộ Việt Nam” tại",
            "points": []
          }
        ]
      },
      {
        "article": "Điều 22",
        "title": "Thông tư số 23/2012/TT-BGTVT .",
        "clauses": []
      },
      {
        "article": "Điều 4",
        "title": "Sửa đổi, bổ sung một số điều của Thông tư số 07/2013/TT- BGTVT ngày 03 tháng 5 năm 2013 của Bộ trưởng Bộ Giao thông vận tải",
        "clauses": [
          {
            "no": "1",
            "text": "quy định về quản lý, vận hành và khai thác hệ thống thông tin giấy phép lái xe 1. Thay thế cụm từ “Tổng cục Đường bộ Việt Nam” bằng cụm từ “Cục Đường bộ Việt Nam” tại khoản 1",
            "points": []
          }
        ]
      },
      {
        "article": "Điều 4",
        "title": "; tên",
        "clauses": []
      },
      {
        "article": "Điều 5",
        "title": "; khoản 3",
        "clauses": []
      },
      {
        "article": "Điều 5",
        "title": "; khoản 6",
        "clauses": []
      },
      {
        "article": "Điều 6",
        "title": "; khoản",
        "clauses": [
          {
            "no": "1",
            "text": "2",
            "points": []
          }
        ]
      },
      {
        "article": "Điều 7",
        "title": ";",
        "clauses": []
      },
      {
        "article": "Điều 9",
        "title": "; các khoản 3, khoản 6 và khoản 8",
        "clauses": []
      },
      {
        "article": "Điều 11",
        "title": "; khoản 1",
        "clauses": []
      },
      {
        "article": "Điều 12",
        "title": "; khoản 3",
        "clauses": []
      },
      {
        "article": "Điều 14",
        "title": ";",
        "clauses": []
      },
      {
        "article": "Điều 17",
        "title": "2. Thay thế cụm từ “Tổng Cục",
        "clauses": [
          {
            "no": "1",
            "text": "trưởng Tổng cục Đường bộ Việt Nam” bằng cụm từ “Cục trưởng Cục Đường bộ Việt Nam” tại khoản 1",
            "points": []
          }
        ]
      },
      {
        "article": "Điều 19",
        "title": "3. Thay thế cụm từ “Vụ Quản",
        "clauses": [
          {
            "no": "1",
            "text": "lý phương tiện và Người lái” bằng cụm từ “Phòng Quản lý Vận tải, phương tiện và Người lái” tại khoản 1",
            "points": []
          }
        ]
      },
      {
        "article": "Điều 4",
        "title": "",
        "clauses": []
      },
      {
        "article": "Điều 5",
        "title": "Sửa đổi, bổ sung một số điều của Thông tư số 35/2013/TT- BGTVT ngày 21 tháng 10 năm 2013 của Bộ trưởng Bộ Giao thông vận tải",
        "clauses": [
          {
            "no": "1",
            "text": "quy định về xếp hàng hóa trên xe ô tô khi tham gia giao thông trên đường bộ 1. Thay thế cụm từ “Tổng cục Đường bộ Việt Nam” bằng cụm từ “Cục Đường bộ Việt Nam” tại",
            "points": []
          }
        ]
      },
      {
        "article": "Điều 12",
        "title": "2. Thay thế cụm từ “Tổng Cục",
        "clauses": [
          {
            "no": "1",
            "text": "trưởng Tổng cục Đường bộ Việt Nam” bằng cụm từ “Cục trưởng Cục Đường bộ Việt Nam” tại",
            "points": []
          }
        ]
      },
      {
        "article": "Điều 15",
        "title": "",
        "clauses": []
      }
    ],
    "strategy_used": "dieu",
    "validation": {
      "status": "warning",
      "issues": [
        "Low content preservation: 35.39%"
      ],
      "stats": {
        "original_length": 4933,
        "segmented_length": 1746,
        "preservation_ratio": 0.3539428339752686,
        "total_articles": 29,
        "total_clauses": 14,
        "total_points": 0
      }
    },
    "document_type": "law"
  }
}