{
  "doc_id": "07_2023_TT_BGTVT",
  "meta": {
    "url": "https://thuvienphapluat.vn/van-ban/Thue-Phi-Le-Phi/Thong-tu-07-2023-TT-BGTVT-sua-doi-Thong-tu-tram-thu-phi-gia-dich-vu-su-dung-duong-bo-555013.aspx",
    "crawl_time": "2025-10-15T14:06:06.373920",
    "number": "07/2023/TT-BGTVT",
    "field": "Giao thông",
    "issue_date": "24/05/2023",
    "agency": "BỘ Căn cứ Luật Giao thông đường bộ ngày 13 tháng 11 năm",
    "content": "BỘ GIAO\r\n  THÔNG VẬN TẢI -------- CỘNG HÒA XÃ\r\n  HỘI CHỦ NGHĨA VIỆT NAM Độc lập - Tự do - Hạnh phúc --------------- Số:\r\n  07/2023/TT-BGTVT Hà Nội, ngày\r\n  24 tháng 05 năm 2023 THÔNG TƯ SỬA ĐỔI, BỔ SUNG MỘT SỐ ĐIỀU CÁC THÔNG TƯ VỀ TRẠM THU\r\nPHÍ, GIÁ DỊCH VỤ SỬ DỤNG ĐƯỜNG BỘ Căn cứ Luật Giao thông đường bộ ngày 13 tháng 11 năm\r\n2008; Căn cứ Luật Giá ngày 20 tháng 6 năm 2012; Căn cứ Luật Đầu tư theo phương thức đối tác công tư\r\nngày 18 tháng 6 năm 2020; Căn cứ Nghị định số 177/2013/NĐ-CP ngày 14 tháng 11 năm\r\n2013 của Chính phủ quy định chi tiết và hướng dẫn thi hành một số điều của Luật\r\ngiá; Căn cứ Nghị định số 149/2016/NĐ-CP ngày 11 tháng 11 năm\r\n2016 của Chính phủ sửa đổi, bổ sung một số điều của Nghị định số 177/2013/NĐ-CP ngày 14 tháng 11 năm 2013 của Chính phủ quy định chi tiết và hướng dẫn thi hành\r\nmột số điều của Luật giá; Căn cứ Nghị định số 56/2022/NĐ-CP ngày 24 tháng 8 năm\r\n2022 của Chính phủ quy định chức năng, nhiệm vụ, quyền hạn và cơ cấu tổ chức của\r\nBộ Giao thông vận tải; Căn cứ Quyết định số 19/2020/QĐ-TTg ngày 17 tháng 6 năm\r\n2020 của Thủ tướng Chính phủ về việc thu phí dịch vụ sử dụng đường bộ theo hình\r\nthức điện tử tự động không dừng; Theo đề nghị của Vụ trưởng\r\nVụ Tài chính và Cục trưởng Cục Đường bộ Việt Nam; Bộ trưởng Bộ Giao thông vận\r\ntải ban hành Thông tư sửa đổi, bổ sung một số điều các Thông tư về trạm thu\r\nphí, giá dịch vụ sử dụng đường bộ. Điều 1.\r\nSửa đổi, bổ sung một số điều của Thông tư số 35/2016/TT- BGTVT ngày 15 tháng 11 năm 2016 của Bộ trưởng Bộ Giao thông vận tải\r\nquy định mức giá tối đa dịch vụ sử dụng đường bộ các dự án đầu tư xây dựng đường\r\nbộ để kinh doanh do Bộ Giao thông vận tải quản lý (sau đây gọi là Thông tư số 35/2016/TT-BGTVT ) và Thông tư số 28/2021/TT-BGTVT ngày 30 tháng 11 năm 2021 của\r\nBộ trưởng Bộ Giao thông vận tải sửa đổi, bổ sung một số điều của Thông tư số 35/2016/TT-BGTVT (sau đây gọi là Thông tư\r\nsố 28/2021/TT-BGTVT ). 1. Thay thế cụm từ “Tổng cục\r\nĐường bộ Việt Nam” thành cụm từ “Cục Đường bộ Việt Nam” tại khoản\r\n3 Điều 8 , khoản 6 Điều 9 Thông tư số 35/2016/TT- BGTVT\r\nđã được sửa đổi, bổ sung bởi khoản 12, khoản 13 Điều 1 Thông tư\r\nsố 28/2021/TT-BGTVT . 2. Thay thế cụm từ “Tổng cục\r\nĐường bộ Việt Nam” thành cụm từ “Cục Đường bộ Việt Nam” tại Điều\r\n10 Thông tư số 35/2016/TT-BGTVT đã được sửa đổi, bổ sung bởi khoản\r\n14 Điều 1 Thông tư số 28/2021/TT-BGTVT . 3. Thay thế cụm từ “Tổng cục\r\ntrưởng Tổng cục Đường bộ Việt Nam” thành cụm từ “Cục trưởng Cục Đường bộ Việt\r\nNam” tại: a) Khoản 2 Điều\r\n12 Thông tư số 35/2016/TT-BGTVT ; b) Điều 5\r\nThông tư số 28/2021/TT-BGTVT . Điều 2.\r\nSửa đổi, bổ sung một số điều của Thông tư số 45/2021/TT- BGTVT ngày 31 tháng 12 năm 2021 của Bộ trưởng Bộ Giao thông vận tải\r\nquy định về hoạt động trạm thu phí đường bộ. 1. Thay thế cụm từ “Tổng cục\r\nĐường bộ Việt Nam” thành cụm từ “Cục Đường bộ Việt Nam” tại khoản\r\n1 Điều 12, khoản 1 Điều 24, điểm a khoản 1 Điều 29 , khoản 1 Điều 32 , điểm b mục 5 Phụ lục 1 . 2.\r\nThay thế cụm từ “Tổng cục trưởng Tổng cục Đường bộ Việt Nam” thành cụm từ “Cục\r\ntrưởng Cục Đường bộ Việt Nam” tại khoản 1 Điều 32 . Điều 3. Hiệu lực thi hành Thông\r\ntư này có hiệu lực thi hành kể từ ngày 01 tháng 8 năm 2023. Điều 4. Tổ chức thực hiện Chánh\r\nVăn phòng Bộ, Chánh Thanh tra Bộ, các Vụ trưởng, Cục trưởng Cục Đường bộ Việt\r\nNam, Thủ trưởng các cơ quan, tổ chức và cá nhân có liên quan chịu trách nhiệm\r\nthi hành Thông tư này./. Nơi nhận: - Văn phòng Chính phủ; - Các Bộ, cơ quan ngang Bộ, cơ quan thuộc Chính phủ; - UBND các tỉnh, thành phố trực thuộc TW; - Bộ trưởng (để b/c); - Các Thứ trưởng Bộ Giao thông vận tải; - Cục Kiểm tra văn bản (Bộ Tư pháp): - Công báo; - Cổng Thông tin điện tử Chính phủ; - Cổng Thông tin điện tử Bộ Giao thông vận tải; - Báo Giao thông, Tạp chí GTVT; - Lưu: VT, TC. KT. BỘ TRƯỞNG THỨ TRƯỞNG Lê Đình Thọ"
  },
  "structure": {
    "articles": [
      {
        "article": "Điều 1",
        "title": "Sửa đổi, bổ sung một số điều của Thông tư số 35/2016/TT- BGTVT ngày 15 tháng 11 năm 2016 của Bộ trưởng Bộ Giao thông vận tải",
        "clauses": [
          {
            "no": "1",
            "text": "quy định mức giá tối đa dịch vụ sử dụng đường bộ các dự án đầu tư xây dựng đường bộ để kinh doanh do Bộ Giao thông vận tải quản lý (sau đây gọi là Thông tư số 35/2016/TT-BGTVT ) và Thông tư số 28/2021/TT-BGTVT ngày 30 tháng 11 năm 2021 của Bộ trưởng Bộ Giao thông vận tải sửa đổi, bổ sung một số điều của Thông tư số 35/2016/TT-BGTVT (sau đây gọi là Thông tư số 28/2021/TT-BGTVT ). 1. Thay thế cụm từ “Tổng cục Đường bộ Việt Nam” thành cụm từ “Cục Đường bộ Việt Nam” tại khoản 3",
            "points": []
          }
        ]
      },
      {
        "article": "Điều 8",
        "title": ", khoản 6",
        "clauses": []
      },
      {
        "article": "Điều 9",
        "title": "Thông tư số 35/2016/TT- BGTVT",
        "clauses": [
          {
            "no": "1",
            "text": "đã được sửa đổi, bổ sung bởi khoản 12, khoản 13",
            "points": []
          }
        ]
      },
      {
        "article": "Điều 1",
        "title": "Thông tư",
        "clauses": [
          {
            "no": "1",
            "text": "số 28/2021/TT-BGTVT . 2. Thay thế cụm từ “Tổng cục Đường bộ Việt Nam” thành cụm từ “Cục Đường bộ Việt Nam” tại",
            "points": []
          }
        ]
      },
      {
        "article": "Điều 10",
        "title": "Thông tư số 35/2016/TT-BGTVT đã được sửa đổi, bổ sung bởi khoản",
        "clauses": [
          {
            "no": "1",
            "text": "14",
            "points": []
          }
        ]
      },
      {
        "article": "Điều 1",
        "title": "Thông tư số 28/2021/TT-BGTVT . 3. Thay thế cụm từ “Tổng cục",
        "clauses": [
          {
            "no": "1",
            "text": "trưởng Tổng cục Đường bộ Việt Nam” thành cụm từ “Cục trưởng Cục Đường bộ Việt Nam” tại: a) Khoản 2",
            "points": []
          }
        ]
      },
      {
        "article": "Điều 12",
        "title": "Thông tư số 35/2016/TT-BGTVT ; b)",
        "clauses": []
      },
      {
        "article": "Điều 5",
        "title": "Thông tư số 28/2021/TT-BGTVT .",
        "clauses": []
      },
      {
        "article": "Điều 2",
        "title": "Sửa đổi, bổ sung một số điều của Thông tư số 45/2021/TT- BGTVT ngày 31 tháng 12 năm 2021 của Bộ trưởng Bộ Giao thông vận tải",
        "clauses": [
          {
            "no": "1",
            "text": "quy định về hoạt động trạm thu phí đường bộ. 1. Thay thế cụm từ “Tổng cục Đường bộ Việt Nam” thành cụm từ “Cục Đường bộ Việt Nam” tại khoản 1",
            "points": []
          }
        ]
      },
      {
        "article": "Điều 12",
        "title": ", khoản 1",
        "clauses": []
      },
      {
        "article": "Điều 24",
        "title": ", điểm a khoản 1",
        "clauses": []
      },
      {
        "article": "Điều 29",
        "title": ", khoản 1",
        "clauses": []
      },
      {
        "article": "Điều 32",
        "title": ", điểm b mục 5 Phụ lục 1 . 2.",
        "clauses": [
          {
            "no": "1",
            "text": "Thay thế cụm từ “Tổng cục trưởng Tổng cục Đường bộ Việt Nam” thành cụm từ “Cục trưởng Cục Đường bộ Việt Nam” tại khoản 1",
            "points": []
          }
        ]
      },
      {
        "article": "Điều 32",
        "title": "",
        "clauses": []
      },
      {
        "article": "Điều 3",
        "title": "Hiệu lực thi hành Thông",
        "clauses": [
          {
            "no": "1",
            "text": "tư này có hiệu lực thi hành kể từ ngày 01 tháng 8 năm 2023.",
            "points": []
          }
        ]
      },
      {
        "article": "Điều 4",
        "title": "Tổ chức thực hiện Chánh",
        "clauses": [
          {
            "no": "1",
            "text": "Văn phòng Bộ, Chánh Thanh tra Bộ, các Vụ trưởng, Cục trưởng Cục Đường bộ Việt Nam, Thủ trưởng các cơ quan, tổ chức và cá nhân có liên quan chịu trách nhiệm thi hành Thông tư này./. Nơi nhận: - Văn phòng Chính phủ; - Các Bộ, cơ quan ngang Bộ, cơ quan thuộc Chính phủ; - UBND các tỉnh, thành phố trực thuộc TW; - Bộ trưởng (để b/c); - Các Thứ trưởng Bộ Giao thông vận tải; - Cục Kiểm tra văn bản (Bộ Tư pháp): - Công báo; - Cổng Thông tin điện tử Chính phủ; - Cổng Thông tin điện tử Bộ Giao thông vận tải; - Báo Giao thông, Tạp chí GTVT; - Lưu: VT, TC. KT. BỘ TRƯỞNG THỨ TRƯỞNG Lê Đình Thọ",
            "points": []
          }
        ]
      }
    ],
    "strategy_used": "dieu",
    "validation": {
      "status": "warning",
      "issues": [
        "Low content preservation: 43.82%"
      ],
      "stats": {
        "original_length": 3747,
        "segmented_length": 1642,
        "preservation_ratio": 0.4382172404590339,
        "total_articles": 16,
        "total_clauses": 9,
        "total_points": 0
      }
    },
    "document_type": "law"
  }
}