{
  "doc_id": "07_VBHN_BKHCN",
  "meta": {
    "url": "https://thuvienphapluat.vn/van-ban/Bo-may-hanh-chinh/Van-ban-hop-nhat-07-VBHN-BKHCN-2018-quy-dinh-thu-tuc-cap-giay-phep-van-chuyen-hang-nguy-hiem-410946.aspx",
    "crawl_time": "2025-10-15T12:23:31.171746",
    "number": "07/VBHN-BKHCN",
    "field": "Giao thông",
    "issue_date": "25/09/2018",
    "agency": "BỘ KHOA HỌC",
    "content": "BỘ KHOA HỌC\r\n  VÀ CÔNG NGHỆ -------- CỘNG HÒA XÃ\r\n  HỘI CHỦ NGHĨA VIỆT NAM Độc lập - Tự do - Hạnh phúc --------------- Số:\r\n  07/VBHN-BKHCN Hà Nội, ngày\r\n  25 tháng 9 năm 2018 THÔNG TƯ QUY ĐỊNH TRÌNH TỰ, THỦ TỤC CẤP GIẤY PHÉP VẬN CHUYỂN HÀNG\r\nNGUY HIỂM LÀ CÁC CHẤT ÔXY HÓA, CÁC HỢP CHẤT Ô XÍT HỮU CƠ (THUỘC LOẠI 5) VÀ CÁC\r\nCHẤT ĂN MÒN (THUỘC LOẠI 8) BẰNG PHƯƠNG TIỆN GIAO THÔNG CƠ GIỚI ĐƯỜNG BỘ, ĐƯỜNG\r\nSẮT VÀ ĐƯỜNG THỦY NỘI ĐỊA Thông tư số 09/2016/TT-BKHCN ngày 09 tháng 6 năm\r\n2016 của Bộ trưởng Bộ Khoa học và Công nghệ quy định trình tự, thủ tục cấp giấy\r\nphép vận chuyển hàng nguy hiểm là các chất ôxy hóa, các hợp chất ô xít hữu cơ\r\n(thuộc loại 5) và các chất ăn mòn (thuộc loại 8) bằng phương tiện giao thông cơ\r\ngiới đường bộ, đường sắt và đường thủy nội địa, có hiệu lực thi hành kể từ ngày\r\n15 tháng 8 năm 2016, được sửa đổi, bổ sung bởi: Thông tư số 09/2018/TT-BKHCN ngày 01 tháng 7 năm\r\n2018 của Bộ trưởng Bộ Khoa học và Công nghệ sửa đổi, bổ sung một số điều của\r\nThông tư số 09/2016/TT-BKHCN ngày 09 tháng 6 năm 2016 của Bộ trưởng Bộ Khoa học\r\nvà Công nghệ quy định trình tự, thủ tục cấp giấy phép vận chuyển hàng nguy hiểm\r\nlà các chất ôxy hóa, các hợp chất ô xít hữu cơ (thuộc loại 5) và các chất ăn\r\nmòn (thuộc loại 8) bằng phương tiện giao thông cơ giới đường bộ, đường sắt và\r\nđường thủy nội địa, có hiệu lực thi hành kể từ ngày 15 tháng 8 năm 2018. Căn cứ Luật Hóa chất ngày 21 tháng 11 năm\r\n2007; Căn cứ Luật Chất lượng sản phẩm, hàng hóa\r\nngày 21 tháng 11 năm 2007; Căn cứ Nghị định số 29/2005/NĐ-CP ngày 10\r\ntháng 3 năm 2005 của Chính phủ quy định danh mục hàng hóa nguy hiểm và việc vận\r\ntải hàng hóa nguy hiểm trên đường thủy nội địa; Căn cứ Nghị định số 108/2008/NĐ-CP ngày 07\r\ntháng 10 năm 2008 của Chính phủ quy định chi tiết và hướng dẫn thi hành một số điều\r\ncủa Luật Hóa chất và Nghị định số 26/2011/NĐ-CP ngày 08 tháng 4 năm 2011 của\r\nChính phủ sửa đổi, bổ sung một số điều của Nghị định số 108/2008/NĐ-CP quy định\r\nchi tiết và hướng dẫn thi hành một số điều của Luật Hóa chất; Căn cứ Nghị định số 104/2009/NĐ-CP ngày 09\r\ntháng 11 năm 2009 của Chính phủ quy định danh mục hàng nguy hiểm và vận chuyển\r\nhàng nguy hiểm bằng phương tiện giao thông cơ giới đường bộ; Căn cứ Nghị định số 14/2015/NĐ-CP ngày 13\r\ntháng 02 năm 2015 của Chính phủ quy định chi tiết và hướng dẫn thi hành một số điều\r\ncủa Luật Đường sắt; Căn cứ Nghị định số 20/2013/NĐ-CP ngày 26\r\ntháng 02 năm 2013 của Chính phủ quy định chức năng, nhiệm vụ, quyền hạn và cơ cấu\r\ntổ chức của Bộ Khoa học và Công nghệ; Theo đề nghị của Tổng cục trưởng Tổng cục\r\nTiêu chuẩn Đo lường Chất lượng và Vụ trưởng Vụ Pháp chế, Bộ trưởng Bộ Khoa học và Công nghệ ban hành\r\nThông tư quy định trình tự, thủ tục cấp giấy phép vận chuyển hàng nguy hiểm là\r\ncác chất ô xy hóa, các hợp chất ô xít hữu cơ (thuộc loại 5) và các chất ăn mòn\r\n(thuộc loại 8) bằng phương tiện giao thông cơ giới đường bộ, đường sắt và đường\r\nthủy nội địa thuộc trách nhiệm của Bộ Khoa học và Công nghệ [1] . Chương I QUY ĐỊNH CHUNG Điều 1.\r\nPhạm vi điều chỉnh 1. Thông tư này quy định về trách\r\nnhiệm và trình tự, thủ tục cấp giấy phép vận chuyển hàng nguy hiểm là các chất ôxy hóa, các hợp chất ô xít hữu cơ (thuộc loại 5), các chất ăn mòn (thuộc\r\nloại 8) (sau đây viết tắt là hàng nguy hiểm) được quy định tại: a) Khoản 1 Điều 4 Nghị định\r\nsố 104/2009/NĐ-CP ngày 09 tháng 11 năm 2009 của Chính phủ quy định danh mục\r\nhàng nguy hiểm và vận chuyển hàng nguy hiểm bằng phương tiện giao thông cơ giới\r\nđường bộ; b) Khoản 1 Điều 4 Nghị định\r\nsố 29/2005/NĐ-CP ngày 10 tháng 3 năm 2005 của Chính phủ quy định danh mục hàng\r\nhóa nguy hiểm và việc vận tải hàng hóa nguy hiểm trên đường thủy nội địa; c) Khoản 1 Điều 22 Nghị định\r\nsố 14/2015/NĐ-CP ngày 13 tháng 02 năm 2015 của Chính phủ quy định chi tiết và\r\nhướng dẫn thi hành một số điều của Luật Đường sắt. 2. Việc vận chuyển hàng nguy\r\nhiểm phục vụ các mục đích sau không thuộc phạm vi điều chỉnh của Thông tư này: a) Hàng nguy hiểm phục vụ mục đích quốc phòng,\r\nan ninh của lực lượng vũ trang; b) Hàng nguy hiểm trong trường hợp đặc biệt quy\r\nđịnh tại Khoản 4 Điều 2 Nghị định số 104/2009/NĐ-CP , Điều 27 Nghị định số 14/2015/NĐ-CP , cụ thể: - Hàng phục vụ cho yêu cầu cấp bách phòng, chống\r\ndịch bệnh, thiên tai, địch họa; - Hàng quá cảnh của các nước, tổ chức quốc tế mà\r\nViệt Nam không ký kết hoặc gia nhập Điều ước quốc tế liên quan với các nước, tổ\r\nchức quốc tế đó. 3. Trường hợp Điều ước quốc tế liên quan đến vận\r\nchuyển hàng nguy hiểm bằng phương tiện giao thông cơ giới đường bộ, đường sắt,\r\nđường thủy nội địa mà Cộng hòa xã hội chủ nghĩa Việt Nam là thành viên có quy định\r\nkhác với Thông tư này thì áp dụng quy định của Điều ước quốc tế đó. Điều 2.\r\nĐối tượng áp dụng 1. Tổ chức, cá nhân trong nước và ngoài nước\r\n(sau đây viết tắt là tổ chức, cá nhân) thực hiện việc vận chuyển và tổ chức, cá\r\nnhân khác có liên quan đến vận chuyển hàng nguy hiểm bằng phương tiện giao\r\nthông cơ giới đường bộ, đường sắt, đường thủy nội địa trên lãnh thổ Việt Nam. 2. Cơ quan quản lý nhà nước có chức năn"
  },
  "structure": {
    "articles": [
      {
        "article": "Điều 1",
        "title": "Phạm vi điều chỉnh 1. Thông tư này quy định về trách",
        "clauses": [
          {
            "no": "1",
            "text": "nhiệm và trình tự, thủ tục cấp giấy phép vận chuyển hàng nguy hiểm là các chất ôxy hóa, các hợp chất ô xít hữu cơ (thuộc loại 5), các chất ăn mòn (thuộc loại 8) (sau đây viết tắt là hàng nguy hiểm) được quy định tại: a) Khoản 1",
            "points": []
          }
        ]
      },
      {
        "article": "Điều 4",
        "title": "Nghị định",
        "clauses": [
          {
            "no": "1",
            "text": "số 104/2009/NĐ-CP ngày 09 tháng 11 năm 2009 của Chính phủ quy định danh mục hàng nguy hiểm và vận chuyển hàng nguy hiểm bằng phương tiện giao thông cơ giới đường bộ; b) Khoản 1",
            "points": []
          }
        ]
      },
      {
        "article": "Điều 4",
        "title": "Nghị định",
        "clauses": [
          {
            "no": "1",
            "text": "số 29/2005/NĐ-CP ngày 10 tháng 3 năm 2005 của Chính phủ quy định danh mục hàng hóa nguy hiểm và việc vận tải hàng hóa nguy hiểm trên đường thủy nội địa; c) Khoản 1",
            "points": []
          }
        ]
      },
      {
        "article": "Điều 22",
        "title": "Nghị định",
        "clauses": [
          {
            "no": "1",
            "text": "số 14/2015/NĐ-CP ngày 13 tháng 02 năm 2015 của Chính phủ quy định chi tiết và hướng dẫn thi hành một số điều của Luật Đường sắt. 2. Việc vận chuyển hàng nguy hiểm phục vụ các mục đích sau không thuộc phạm vi điều chỉnh của Thông tư này: a) Hàng nguy hiểm phục vụ mục đích quốc phòng, an ninh của lực lượng vũ trang; b) Hàng nguy hiểm trong trường hợp đặc biệt quy định tại Khoản 4",
            "points": []
          }
        ]
      },
      {
        "article": "Điều 2",
        "title": "Nghị định số 104/2009/NĐ-CP ,",
        "clauses": []
      },
      {
        "article": "Điều 27",
        "title": "Nghị định số 14/2015/NĐ-CP , cụ thể: - Hàng phục vụ cho yêu cầu cấp bách phòng, chống",
        "clauses": [
          {
            "no": "1",
            "text": "dịch bệnh, thiên tai, địch họa; - Hàng quá cảnh của các nước, tổ chức quốc tế mà Việt Nam không ký kết hoặc gia nhập Điều ước quốc tế liên quan với các nước, tổ chức quốc tế đó. 3. Trường hợp Điều ước quốc tế liên quan đến vận chuyển hàng nguy hiểm bằng phương tiện giao thông cơ giới đường bộ, đường sắt, đường thủy nội địa mà Cộng hòa xã hội chủ nghĩa Việt Nam là thành viên có quy định khác với Thông tư này thì áp dụng quy định của Điều ước quốc tế đó.",
            "points": []
          }
        ]
      },
      {
        "article": "Điều 2",
        "title": "Đối tượng áp dụng 1. Tổ chức, cá nhân trong nước và ngoài nước",
        "clauses": [
          {
            "no": "1",
            "text": "(sau đây viết tắt là tổ chức, cá nhân) thực hiện việc vận chuyển và tổ chức, cá nhân khác có liên quan đến vận chuyển hàng nguy hiểm bằng phương tiện giao thông cơ giới đường bộ, đường sắt, đường thủy nội địa trên lãnh thổ Việt Nam. 2. Cơ quan quản lý nhà nước có chức năn",
            "points": []
          }
        ]
      }
    ],
    "validation": {
      "status": "warning",
      "issues": [
        "Low content preservation: 33.91%"
      ],
      "stats": {
        "original_length": 4936,
        "segmented_length": 1674,
        "preservation_ratio": 0.33914100486223664,
        "total_articles": 7,
        "total_clauses": 6,
        "total_points": 0
      }
    },
    "document_type": "circular"
  }
}