{
  "doc_id": "09_2016_TT_BKHCN",
  "meta": {
    "url": "https://thuvienphapluat.vn/van-ban/Giao-thong-Van-tai/Thong-tu-09-2016-TT-BKHCN-trinh-tu-thu-tuc-cap-giay-phep-van-chuyen-hang-nguy-hiem-chat-oxy-hoa-318393.aspx",
    "crawl_time": "2025-10-15T12:23:10.564579",
    "number": "09/2016/TT-BKHCN",
    "field": "Giao thông",
    "issue_date": "09/06/2016",
    "agency": "BỘ KHOA HỌC VÀ CÔNG NGHỆ",
    "content": "BỘ KHOA HỌC VÀ CÔNG NGHỆ ------- CỘNG HÒA XÃ HỘI\r\n  CHỦ NGHĨA VIỆT NAM Độc lập - Tự do - Hạnh phúc --------------- Số:\r\n  09/2016/TT-BKHCN Hà Nội, ngày 09\r\n  tháng 06 năm 2016 THÔNG TƯ QUY\r\nĐỊNH TRÌNH TỰ, THỦ TỤC CẤP GIẤY PHÉP VẬN CHUYỂN HÀNG NGUY HIỂM LÀ CÁC CHẤT ÔXY\r\nHÓA, CÁC HỢP CHẤT Ô XÍT HỮU CƠ (THUỘC LOẠI 5) VÀ CÁC CHẤT ĂN MÒN (THUỘC LOẠI 8)\r\nBẰNG PHƯƠNG TIỆN GIAO THÔNG CƠ GIỚI ĐƯỜNG BỘ, ĐƯỜNG SẮT VÀ ĐƯỜNG THỦY NỘI ĐỊA Căn cứ Luật Hóa chất ngày 21 tháng 11 năm 2007; Căn cứ Luật Chất lượng sản phẩm, hàng hóa ngày\r\n21 tháng 11 năm 2007; Căn cứ Nghị định số 29/2005/NĐ-CP ngày 10 tháng\r\n3 năm 2005 của Chính phủ quy định danh Mục hàng hóa nguy hiểm và việc vận tải\r\nhàng hóa nguy hiểm trên đường thủy nội địa; Căn cứ Nghị định số 108/2008/NĐ-CP ngày 07 tháng\r\n10 năm 2008 của Chính phủ quy định chi Tiết và hướng dẫn thi hành một số Điều của\r\nLuật Hóa chất và Nghị định số 26/2011/NĐ-CP ngày 08 tháng 4 năm 2011 của Chính\r\nphủ sửa đổi, bổ sung một số Điều của Nghị định số 108/2008/NĐ-CP quy định chi\r\nTiết và hướng dẫn thi hành một số Điều của Luật Hóa chất; Căn cứ Nghị định số 104/2009/NĐ-CP ngày 09 tháng\r\n11 năm 2009 của Chính phủ quy định danh Mục hàng nguy hiểm và vận chuyển hàng\r\nnguy hiểm bằng phương tiện giao thông cơ giới đường bộ; Căn cứ Nghị định số 14/2015/NĐ-CP ngày 13 tháng\r\n02 năm 2015 của Chính phủ quy định chi Tiết và hướng dẫn thi hành một số Điều của\r\nLuật Đường sắt; Căn cứ Nghị định số 20/2013/NĐ-CP ngày 26 tháng\r\n02 năm 2013 của Chính phủ quy định chức năng, nhiệm vụ, quyền hạn và cơ cấu tổ\r\nchức của Bộ Khoa học và Công nghệ; Theo đề nghị của Tổng cục trưởng Tổng cục Tiêu\r\nchuẩn Đo lường Chất lượng và Vụ trưởng Vụ Pháp chế, Bộ trưởng Bộ Khoa học và Công nghệ ban hành\r\nThông tư quy định trình tự, thủ tục cấp giấy phép vận chuyển hàng nguy hiểm là\r\ncác chất ô xy hóa, các hợp chất ô xít hữu cơ (thuộc loại 5) và các chất ăn mòn\r\n(thuộc loại 8) bằng phương tiện giao thông cơ giới đường bộ, đường sắt và đường\r\nthủy nội địa thuộc trách nhiệm của Bộ Khoa học và Công nghệ. Chương I QUY ĐỊNH CHUNG Điều 1. Phạm vi Điều chỉnh 1. Thông tư này quy định về trách nhiệm và trình tự,\r\nthủ tục cấp giấy phép vận chuyển hàng nguy hiểm là các chất ôxy hóa, các hợp chất\r\nô xít hữu cơ (thuộc loại 5), các chất ăn mòn (thuộc loại 8) (sau đây viết tắt\r\nlà hàng nguy hiểm) được quy định tại: a) Khoản 1 Điều 4 Nghị định số 104/2009/NĐ-CP ngày 09 tháng 11 năm 2009 của Chính phủ quy định danh Mục\r\nhàng nguy hiểm và vận chuyển hàng nguy hiểm bằng phương tiện giao thông cơ giới\r\nđường bộ; b) Khoản 1 Điều 4 Nghị định số 29/2005/NĐ-CP ngày 10 tháng 3 năm 2005 của Chính phủ quy định danh Mục hàng\r\nhóa nguy hiểm và việc vận tải hàng hóa nguy hiểm trên đường thủy nội địa; c) Khoản 1 Điều 22 Nghị định số 14/2015/NĐ-CP ngày 13 tháng 02 năm 2015 của Chính phủ quy định chi Tiết và\r\nhướng dẫn thi hành một số Điều của Luật Đường sắt. 2. Việc vận chuyển hàng nguy hiểm phục vụ các Mục\r\nđích sau không thuộc phạm vi Điều chỉnh của Thông tư này: a) Hàng nguy hiểm phục vụ Mục đích quốc phòng, an\r\nninh của lực lượng vũ trang; b) Hàng nguy hiểm trong trường hợp đặc biệt quy định\r\ntại Khoản 4 Điều 2 Nghị định số 104/2009/NĐ-CP , Điều 27 Nghị định số 14/2015/NĐ-CP , cụ thể: - Hàng phục vụ cho yêu cầu cấp bách phòng, chống dịch\r\nbệnh, thiên tai, địch họa; - Hàng quá cảnh của các nước, tổ chức quốc tế mà Việt\r\nNam không ký kết hoặc gia nhập Điều ước quốc tế liên quan với các nước, tổ chức\r\nquốc tế đó. 3. Trường hợp Điều ước quốc tế liên quan đến vận\r\nchuyển hàng nguy hiểm bằng phương tiện giao thông cơ giới đường bộ, đường sắt,\r\nđường thủy nội địa mà Cộng hòa xã hội chủ nghĩa Việt Nam là thành viên có quy định\r\nkhác với Thông tư này thì áp dụng quy định của Điều ước quốc tế đó. Điều 2. Đối tượng áp dụng 1. Tổ chức, cá nhân trong nước và ngoài nước (sau\r\nđây viết tắt là tổ chức, cá nhân) thực hiện việc vận chuyển và tổ chức, cá nhân\r\nkhác có liên quan đến vận chuyển hàng nguy hiểm bằng phương tiện giao thông cơ\r\ngiới đường bộ, đường sắt, đường thủy nội địa trên lãnh thổ Việt Nam. 2. Cơ quan quản lý nhà nước có chức năng quản lý\r\ncông tác vận chuyển hàng nguy hiểm bằng phương tiện giao thông cơ giới đường bộ,\r\nđường sắt, đường thủy nội địa trên lãnh thổ Việt Nam. Điều 3. Giải thích từ ngữ 1. Số UN (United Nations) là số có bốn chữ số,\r\nđược quy định theo hệ thống của Liên hợp quốc để xác định các hàng nguy hiểm. 2. Giấy phép vận chuyển hàng nguy hiểm là giấy\r\nphép do cơ quan nhà nước có thẩm quyền cấp cho các tổ chức, cá nhân có nhu cầu\r\nvận chuyển hàng nguy hiểm bằng phương tiện giao thông cơ giới đường bộ, đường sắt,\r\nđường thủy nội địa. 3. Các thuật ngữ khác sử dụng trong Thông tư này được\r\nquy định tại Luật Hóa chất và các văn bản quy phạm pháp luật hướng dẫn thi hành\r\nLuật Hóa chất. Chương II TRÌNH TỰ, THỦ TỤC CẤP GIẤY\r\nPHÉP VẬN CHUYỂN HÀNG NGUY HIỂM Điều 4. Hồ sơ đề nghị cấp Giấy\r\nphép vận chuyển hàng nguy hiểm và các hình thức nộp hồ sơ 1. Hồ sơ đề nghị cấp Giấy phép vận chuyển hàng nguy\r\nhiểm bao gồm: a) Đơn đề nghị cấp Giấy phép vận chuyển hà"
  },
  "structure": {
    "articles": [
      {
        "article": "Điều 1",
        "title": "Phạm vi Điều chỉnh 1. Thông tư này quy định về trách nhiệm và trình tự,",
        "clauses": [
          {
            "no": "1",
            "text": "thủ tục cấp giấy phép vận chuyển hàng nguy hiểm là các chất ôxy hóa, các hợp chất ô xít hữu cơ (thuộc loại 5), các chất ăn mòn (thuộc loại 8) (sau đây viết tắt là hàng nguy hiểm) được quy định tại: a) Khoản 1",
            "points": []
          }
        ]
      },
      {
        "article": "Điều 4",
        "title": "Nghị định số 104/2009/NĐ-CP ngày 09 tháng 11 năm 2009 của Chính phủ quy định danh Mục",
        "clauses": [
          {
            "no": "1",
            "text": "hàng nguy hiểm và vận chuyển hàng nguy hiểm bằng phương tiện giao thông cơ giới đường bộ; b) Khoản 1",
            "points": []
          }
        ]
      },
      {
        "article": "Điều 4",
        "title": "Nghị định số 29/2005/NĐ-CP ngày 10 tháng 3 năm 2005 của Chính phủ quy định danh Mục hàng",
        "clauses": [
          {
            "no": "1",
            "text": "hóa nguy hiểm và việc vận tải hàng hóa nguy hiểm trên đường thủy nội địa; c) Khoản 1",
            "points": []
          }
        ]
      },
      {
        "article": "Điều 22",
        "title": "Nghị định số 14/2015/NĐ-CP ngày 13 tháng 02 năm 2015 của Chính phủ quy định chi Tiết và",
        "clauses": [
          {
            "no": "1",
            "text": "hướng dẫn thi hành một số Điều của Luật Đường sắt. 2. Việc vận chuyển hàng nguy hiểm phục vụ các Mục đích sau không thuộc phạm vi Điều chỉnh của Thông tư này: a) Hàng nguy hiểm phục vụ Mục đích quốc phòng, an ninh của lực lượng vũ trang; b) Hàng nguy hiểm trong trường hợp đặc biệt quy định tại Khoản 4",
            "points": []
          }
        ]
      },
      {
        "article": "Điều 2",
        "title": "Nghị định số 104/2009/NĐ-CP ,",
        "clauses": []
      },
      {
        "article": "Điều 27",
        "title": "Nghị định số 14/2015/NĐ-CP , cụ thể: - Hàng phục vụ cho yêu cầu cấp bách phòng, chống dịch",
        "clauses": [
          {
            "no": "1",
            "text": "bệnh, thiên tai, địch họa; - Hàng quá cảnh của các nước, tổ chức quốc tế mà Việt Nam không ký kết hoặc gia nhập Điều ước quốc tế liên quan với các nước, tổ chức quốc tế đó. 3. Trường hợp Điều ước quốc tế liên quan đến vận chuyển hàng nguy hiểm bằng phương tiện giao thông cơ giới đường bộ, đường sắt, đường thủy nội địa mà Cộng hòa xã hội chủ nghĩa Việt Nam là thành viên có quy định khác với Thông tư này thì áp dụng quy định của Điều ước quốc tế đó.",
            "points": []
          }
        ]
      },
      {
        "article": "Điều 2",
        "title": "Đối tượng áp dụng 1. Tổ chức, cá nhân trong nước và ngoài nước (sau",
        "clauses": [
          {
            "no": "1",
            "text": "đây viết tắt là tổ chức, cá nhân) thực hiện việc vận chuyển và tổ chức, cá nhân khác có liên quan đến vận chuyển hàng nguy hiểm bằng phương tiện giao thông cơ giới đường bộ, đường sắt, đường thủy nội địa trên lãnh thổ Việt Nam. 2. Cơ quan quản lý nhà nước có chức năng quản lý công tác vận chuyển hàng nguy hiểm bằng phương tiện giao thông cơ giới đường bộ, đường sắt, đường thủy nội địa trên lãnh thổ Việt Nam.",
            "points": []
          }
        ]
      },
      {
        "article": "Điều 3",
        "title": "Giải thích từ ngữ 1. Số UN (United Nations) là số có bốn chữ số,",
        "clauses": [
          {
            "no": "1",
            "text": "được quy định theo hệ thống của Liên hợp quốc để xác định các hàng nguy hiểm. 2. Giấy phép vận chuyển hàng nguy hiểm là giấy phép do cơ quan nhà nước có thẩm quyền cấp cho các tổ chức, cá nhân có nhu cầu vận chuyển hàng nguy hiểm bằng phương tiện giao thông cơ giới đường bộ, đường sắt, đường thủy nội địa. 3. Các thuật ngữ khác sử dụng trong Thông tư này được quy định tại Luật Hóa chất và các văn bản quy phạm pháp luật hướng dẫn thi hành Luật Hóa chất. Chương II TRÌNH TỰ, THỦ TỤC CẤP GIẤY PHÉP VẬN CHUYỂN HÀNG NGUY HIỂM",
            "points": []
          }
        ]
      },
      {
        "article": "Điều 4",
        "title": "Hồ sơ đề nghị cấp Giấy",
        "clauses": [
          {
            "no": "1",
            "text": "phép vận chuyển hàng nguy hiểm và các hình thức nộp hồ sơ 1. Hồ sơ đề nghị cấp Giấy phép vận chuyển hàng nguy hiểm bao gồm: a) Đơn đề nghị cấp Giấy phép vận chuyển hà",
            "points": []
          }
        ]
      }
    ],
    "strategy_used": "dieu",
    "validation": {
      "status": "warning",
      "issues": [
        "Low content preservation: 45.42%"
      ],
      "stats": {
        "original_length": 4943,
        "segmented_length": 2245,
        "preservation_ratio": 0.45417762492413516,
        "total_articles": 9,
        "total_clauses": 8,
        "total_points": 0
      }
    },
    "document_type": "law"
  }
}