{
  "doc_id": "101_2024_QĐ_UBND",
  "meta": {
    "url": "https://thuvienphapluat.vn/van-ban/Giao-thong-Van-tai/Quyet-dinh-101-2024-QD-UBND-duong-giao-thong-thuc-hien-chua-chay-tai-nha-o-nhieu-tang-Ho-Chi-Minh-629980.aspx",
    "crawl_time": "2025-10-15T12:29:55.827746",
    "number": "101/2024/QĐ-UBND",
    "field": "Giao thông",
    "issue_date": "31/10/2024",
    "agency": "ỦY BAN NHÂN DÂN THÀNH PHỐ HỒ CHÍ MINH",
    "content": "ỦY BAN NHÂN DÂN THÀNH PHỐ HỒ CHÍ MINH ------- CỘNG HÒA XÃ HỘI\r\n  CHỦ NGHĨA VIỆT NAM Độc lập - Tự do - Hạnh phúc --------------- Số:\r\n  101/2024/QĐ-UBND Thành phố Hồ Chí\r\n  Minh, ngày 31 tháng 10 năm 2024 QUYẾT ĐỊNH QUY ĐỊNH VỀ ĐƯỜNG GIAO THÔNG ĐỂ PHƯƠNG TIỆN CHỮA CHÁY THỰC\r\nHIỆN NHIỆM VỤ CHỮA CHÁY TẠI NƠI CÓ NHÀ Ở NHIỀU TẦNG, NHIỀU CĂN HỘ CỦA CÁ NHÂN\r\nTRÊN ĐỊA BÀN THÀNH PHỐ HỒ CHÍ MINH ỦY BAN NHÂN DÂN THÀNH PHỐ HỒ CHÍ MINH Căn cứ Luật Tổ chức\r\nchính quyền địa phương ngày 19 tháng 6 năm 2015 và Luật sửa đổi, bổ sung một số\r\nđiều của Luật Tổ chức Chính phủ và Luật Tổ chức chính quyền địa phương ngày 22\r\ntháng 11 năm 2019; Căn cứ Luật Ban hành\r\nvăn bản quy phạm pháp luật ngày 22 tháng 6 năm 2015 và Luật sửa đổi, bổ sung một\r\nsố điều của Luật Ban hành văn bản quy phạm pháp luật ngày 18 tháng 6 năm 2020; Căn cứ Luật Nhà ở ngày\r\n27 tháng 11 năm 2023 và Luật sửa đổi, bổ sung một số điều của Luật Đất đai, Luật\r\nNhà ở và Luật Kinh doanh bất động sản ngày 29 tháng 6 năm 2024; Căn cứ Luật Phòng cháy\r\nvà Chữa cháy ngày 29 tháng 6 năm 2001 và Luật sửa đổi, bổ sung một số điều của\r\nLuật Phòng cháy và chữa cháy ngày 22 tháng 11 năm 2013; Căn cứ Nghị định số 136/2020/NĐ-CP ngày 24 tháng 11 năm 2020 của Chính phủ quy định chi tiết thi\r\nhành một số điều của Luật Phòng cháy và chữa cháy và Luật sửa đổi, bổ sung một\r\nsố điều của Luật Phòng cháy và chữa cháy; Căn cứ Nghị định số 34/2016/NĐ-CP ngày 14 tháng 5 năm 2016 của Chính phủ quy định chi tiết một số\r\nđiều và biện pháp thi hành Luật Ban hành văn bản quy phạm pháp luật; Căn cứ Nghị định số 154/2020/NĐ-CP ngày 31 tháng 12 năm 2020 của Chính phủ sửa đổi, bổ sung một số\r\nđiều của Nghị định số 34/2016/NĐ-CP ngày 14 tháng 5 năm 2016 của Chính phủ quy\r\nđịnh chi tiết một số điều và biện pháp thi hành Luật Ban hành văn bản quy phạm\r\npháp luật; Căn cứ Nghị định số 59/2024/NĐ-CP ngày 25 tháng 5 năm 2024 của Chính phủ sửa đổi, bổ sung một số điều\r\ncủa Nghị định số 34/2016/NĐ-CP ngày 14 tháng 5 năm 2016 của Chính phủ quy định\r\nchi tiết một số điều và biện pháp thi hành luật ban hành văn bản quy phạm pháp\r\nluật đã được sửa đổi, bổ sung một số điều theo Nghị định số 154/2020/NĐ-CP ngày\r\n31 tháng 12 năm 2020 của Chính phủ; Căn cứ Nghị định số 95/2024/NĐ-CP ngày 24 tháng 7 năm 2024 của Chính phủ quy định chi tiết một số điều\r\ncủa Luật Nhà ở; Căn cứ Thông tư số 149/2020/TT-BCA ngày 31 tháng 12 năm 2020 của Bộ trưởng Bộ Công an quy định chi\r\ntiết một số điều và biện pháp thi hành Luật Phòng cháy và chữa cháy và Luật sửa\r\nđổi, bổ sung một số điều của Luật Phòng cháy và chữa cháy và Nghị định số 136/2020/NĐ-CP ngày 24 tháng 11 năm 2020 của Chính phủ quy định chi tiết một số\r\nđiều và biện pháp thi hành luật phòng cháy và chữa cháy và luật sửa đổi, bổ\r\nsung một số điều của luật phòng cháy và chữa cháy; Căn cứ Thông tư số 06/2022/TT-BXD ngày 30 tháng 11 năm 2022 của Bộ trưởng Bộ Xây dựng ban hành\r\nQCVN 06:2022/BXD Quy chuẩn kỹ thuật Quốc gia về An toàn cháy cho nhà và công\r\ntrình; Thông tư số 09/2023/TT-BXD ngày 10 tháng 10 năm 2023 của Bộ trưởng Bộ\r\nXây dựng ban hành sửa đổi 1:2023 QCVN 06:2022/BXD; Căn cứ Thông tư số 15/2023/TT-BXD ngày 29 tháng 12 năm 2023 của Bộ trưởng Bộ Xây dựng ban hành\r\nQCVN 07:2023/BXD Quy chuẩn kỹ thuật quốc gia về hệ thống công trình hạ tầng kỹ\r\nthuật; Theo đề nghị của Giám\r\nđốc Sở Giao thông vận tải tại Tờ trình số 14462/TTr-SGTVT ngày 28 tháng 10 năm\r\n2024; kết quả thẩm định của Sở Tư pháp tại Báo cáo số 7128/BC-STP ngày 28 tháng\r\n10 năm 2024. QUYẾT ĐỊNH: Điều\r\n1. Phạm vi điều chỉnh Quyết định này quy định\r\nchi tiết điểm c khoản 3 Điều 57 Luật Nhà ở ngày 27 tháng 11 năm 2023 (gọi tắt\r\nlà Luật Nhà ở năm 2023) Về điều kiện đường giao thông để phương tiện chữa cháy\r\nthực hiện nhiệm vụ chữa cháy tại nơi có nhà ở nhiều tầng nhiều căn hộ của cá\r\nnhân trên địa bàn Thành phố Hồ Chí Minh. Điều\r\n2. Đối tượng áp dụng Cơ quan quản lý nhà nước,\r\ntổ chức, cá nhân có liên quan đến hoạt động xây dựng nhà ở có từ 02 (hai) tầng\r\ntrở lên và có quy mô dưới 20 (hai mươi) căn hộ mà tại mỗi tầng có thiết kế, xây\r\ndựng căn hộ để cho thuê theo quy định tại khoản 3 Điều 54 và điểm c khoản 3 Điều\r\n57 Luật Nhà ở năm 2023. Điều\r\n3. Nguyên tắc áp dụng 1. Đảm bảo tổ chức thực\r\nhiện quản lý nhà nước về điều kiện đường giao thông để phương tiện chữa cháy thực\r\nhiện nhiệm vụ chữa cháy trên địa bàn Thành phố Hồ Chí Minh. 2. Tạo điều kiện thuận lợi\r\ncho tổ chức, cá nhân tuân thủ quy định Luật Nhà ở năm 2023 và pháp luật về\r\nphòng cháy và chữa cháy. Điều\r\n4. Điều kiện về đường giao thông sử dụng để phương tiện chữa cháy tiếp cận thực\r\nhiện nhiệm vụ chữa cháy (sau đây gọi tắt là đường giao thông phục vụ chữa cháy)\r\ntại nơi xây dựng nhà ở có nhiều tầng, nhiều căn hộ cho thuê 1. Đường giao thông phục\r\nvụ chữa cháy phải đáp ứng các điều kiện để phương tiện chữa cháy lưu thông đảm\r\nbảo thông suốt, an toàn và phải tiếp cận được vị trí nhà ở. 2. Đường giao thông phục\r\nvụ chữa cháy phải đáp ứng các yêu cầu sau: a) Chiều rộng mặt đường\r\nthông thủy không nhỏ hơn 3,50 mét. b) Chiều cao thông thủy\r\nkhông nhỏ hơn 4,"
  },
  "structure": {
    "articles": [
      {
        "article": "Điều 1",
        "title": "Phạm vi điều chỉnh Quyết định này quy định",
        "clauses": [
          {
            "no": "1",
            "text": "chi tiết điểm c khoản 3",
            "points": []
          }
        ]
      },
      {
        "article": "Điều 57",
        "title": "Luật Nhà ở ngày 27 tháng 11 năm 2023 (gọi tắt",
        "clauses": [
          {
            "no": "1",
            "text": "là Luật Nhà ở năm 2023) Về điều kiện đường giao thông để phương tiện chữa cháy thực hiện nhiệm vụ chữa cháy tại nơi có nhà ở nhiều tầng nhiều căn hộ của cá nhân trên địa bàn Thành phố Hồ Chí Minh.",
            "points": []
          }
        ]
      },
      {
        "article": "Điều 2",
        "title": "Đối tượng áp dụng Cơ quan quản lý nhà nước,",
        "clauses": [
          {
            "no": "1",
            "text": "tổ chức, cá nhân có liên quan đến hoạt động xây dựng nhà ở có từ 02 (hai) tầng trở lên và có quy mô dưới 20 (hai mươi) căn hộ mà tại mỗi tầng có thiết kế, xây dựng căn hộ để cho thuê theo quy định tại khoản 3",
            "points": []
          }
        ]
      },
      {
        "article": "Điều 54",
        "title": "và điểm c khoản 3",
        "clauses": []
      },
      {
        "article": "Điều 57",
        "title": "Luật Nhà ở năm 2023.",
        "clauses": []
      },
      {
        "article": "Điều 3",
        "title": "Nguyên tắc áp dụng 1. Đảm bảo tổ chức thực",
        "clauses": [
          {
            "no": "1",
            "text": "hiện quản lý nhà nước về điều kiện đường giao thông để phương tiện chữa cháy thực hiện nhiệm vụ chữa cháy trên địa bàn Thành phố Hồ Chí Minh. 2. Tạo điều kiện thuận lợi cho tổ chức, cá nhân tuân thủ quy định Luật Nhà ở năm 2023 và pháp luật về phòng cháy và chữa cháy.",
            "points": []
          }
        ]
      },
      {
        "article": "Điều 4",
        "title": "Điều kiện về đường giao thông sử dụng để phương tiện chữa cháy tiếp cận thực",
        "clauses": [
          {
            "no": "1",
            "text": "hiện nhiệm vụ chữa cháy (sau đây gọi tắt là đường giao thông phục vụ chữa cháy) tại nơi xây dựng nhà ở có nhiều tầng, nhiều căn hộ cho thuê 1. Đường giao thông phục vụ chữa cháy phải đáp ứng các điều kiện để phương tiện chữa cháy lưu thông đảm bảo thông suốt, an toàn và phải tiếp cận được vị trí nhà ở. 2. Đường giao thông phục vụ chữa cháy phải đáp ứng các yêu cầu sau: a) Chiều rộng mặt đường thông thủy không nhỏ hơn 3,50 mét. b) Chiều cao thông thủy không nhỏ hơn 4,",
            "points": []
          }
        ]
      }
    ],
    "strategy_used": "dieu",
    "validation": {
      "status": "warning",
      "issues": [
        "Low content preservation: 23.62%"
      ],
      "stats": {
        "original_length": 4937,
        "segmented_length": 1166,
        "preservation_ratio": 0.23617581527243264,
        "total_articles": 7,
        "total_clauses": 5,
        "total_points": 0
      }
    },
    "document_type": "law"
  }
}