{
  "doc_id": "1251_QĐ_BGTVT",
  "meta": {
    "url": "https://thuvienphapluat.vn/van-ban/Bo-may-hanh-chinh/Quyet-dinh-1251-QD-BGTVT-2022-chuyen-don-vi-su-nghiep-cong-lap-ve-Cuc-Duong-bo-Viet-Nam-530973.aspx",
    "crawl_time": "2025-10-15T14:02:05.730572",
    "number": "1251/QĐ-BGTVT",
    "field": "Giao thông",
    "issue_date": "28/09/2022",
    "agency": "BỘ GIAO THÔNG VẬN",
    "content": "BỘ GIAO THÔNG VẬN\r\n  TẢI ------- CỘNG HÒA XÃ HỘI\r\n  CHỦ NGHĨA VIỆT NAM Độc lập - Tự do - Hạnh phúc --------------- Số: 1251/QĐ-BGTVT Hà Nội, ngày 28\r\n  tháng 09 năm 2022 QUYẾT ĐỊNH VỀ\r\nVIỆC CHUYỂN NGUYÊN TRẠNG MỘT SỐ ĐƠN VỊ SỰ NGHIỆP CÔNG LẬP TRỰC THUỘC TỔNG CỤC\r\nĐƯỜNG BỘ VIỆT NAM VỀ TRỰC THUỘC CỤC ĐƯỜNG BỘ VIỆT NAM BỘ TRƯỞNG BỘ GIAO THÔNG VẬN TẢI Căn cứ Nghị định số 56/2022/NĐ-CP ngày 24/8/2022 của Chính phủ quy định\r\nchức năng, nhiệm vụ, quyền hạn và cơ cấu tổ chức của Bộ Giao thông vận tải; Căn cứ Kết luận số\r\n39-KL/BCSĐ ngày 30/6/2022 của Ban Cán sự đảng Bộ Giao thông vận tải; Căn cứ Quyết định số 1218/QĐ-BGTVT ngày 23/9/2022 của Bộ trưởng Bộ\r\nGiao thông vận tải quy định chức năng, nhiệm vụ, quyền hạn và cơ cấu tổ chức của\r\nCục Đường bộ Việt Nam; Xét đề nghị của Tổng Cục trưởng\r\nTổng cục Đường bộ Việt Nam tại Tờ trình số 121/TTr-TCĐBVN ngày 22/9/2022; Theo đề nghị của Vụ trưởng Vụ\r\nTổ chức cán bộ. QUYẾT ĐỊNH: Điều 1. Chuyển nguyên trạng\r\nmột số đơn vị sự nghiệp công lập trực thuộc Tổng cục Đường bộ Việt Nam về trực\r\nthuộc Cục Đường bộ Việt Nam, kể từ ngày 01/10/2022, gồm: 1. Ban Quản lý dự án 3. 2. Ban Quản lý dự án 4. 3. Ban Quản lý dự án 5. 4. Ban Quản lý dự án 8. 5. Trung tâm Truyền thông và\r\nThông tin đường bộ. Điều 2. Các đơn vị sự\r\nnghiệp công lập nêu tại Điều 1 Quyết định này tiếp tục duy trì hoạt động cho đến\r\nkhi cơ quan có thẩm quyền hoàn thành việc sắp xếp đối với các đơn vị này theo\r\nquy định tại khoản 1 Điều 5 Quyết định số 1218/QĐ- BGTVT ngày\r\n23/9/2022 của Bộ trưởng Bộ Giao thông vận tải quy định chức năng, nhiệm vụ,\r\nquyền hạn và cơ cấu tổ chức của Cục Đường bộ Việt Nam. Điều 3. Quyết định này\r\ncó hiệu lực kể từ ngày 01/10/2022. Chánh Văn phòng Bộ, Chánh Thanh\r\ntra Bộ, các Vụ trưởng, Cục trưởng Cục Đường bộ Việt Nam và Thủ trưởng các cơ\r\nquan, đơn vị có liên quan chịu trách nhiệm thi hành Quyết định này./. Nơi nhận: - Như Điều 3; - Các Bộ: Nội vụ, Tài chính, Xây dựng, Kế hoạch và Đầu tư, Công an, Thông tin\r\n  và Truyền thông; - Các Thứ trưởng Bộ GTVT; - UBND các tỉnh, thành phố trực thuộc Trung ương; - Tổng cục ĐBVN; - Công an các tỉnh, thành phố: Hà Nội, Nghệ An, Đà Nẵng, Hồ Chí Minh; - Các Ban QLDA: 3, 4, 5, 8; - Trung tâm Truyền thông và Thông tin đường bộ; - Kho bạc Nhà nước (nơi giao dịch); - Lưu: VT, TCCB (TA 05b). BỘ TRƯỞNG Nguyễn Văn Thể"
  },
  "structure": {
    "articles": [
      {
        "article": "Điều 1",
        "title": "Chuyển nguyên trạng",
        "clauses": [
          {
            "no": "1",
            "text": "một số đơn vị sự nghiệp công lập trực thuộc Tổng cục Đường bộ Việt Nam về trực thuộc Cục Đường bộ Việt Nam, kể từ ngày 01/10/2022, gồm: 1. Ban Quản lý dự án 3. 2. Ban Quản lý dự án 4. 3. Ban Quản lý dự án 5. 4. Ban Quản lý dự án 8. 5. Trung tâm Truyền thông và Thông tin đường bộ.",
            "points": []
          }
        ]
      },
      {
        "article": "Điều 2",
        "title": "Các đơn vị sự",
        "clauses": [
          {
            "no": "1",
            "text": "nghiệp công lập nêu tại",
            "points": []
          }
        ]
      },
      {
        "article": "Điều 1",
        "title": "Quyết định này tiếp tục duy trì hoạt động cho đến",
        "clauses": [
          {
            "no": "1",
            "text": "khi cơ quan có thẩm quyền hoàn thành việc sắp xếp đối với các đơn vị này theo quy định tại khoản 1",
            "points": []
          }
        ]
      },
      {
        "article": "Điều 5",
        "title": "Quyết định số 1218/QĐ- BGTVT ngày",
        "clauses": [
          {
            "no": "1",
            "text": "23/9/2022 của Bộ trưởng Bộ Giao thông vận tải quy định chức năng, nhiệm vụ, quyền hạn và cơ cấu tổ chức của Cục Đường bộ Việt Nam.",
            "points": []
          }
        ]
      },
      {
        "article": "Điều 3",
        "title": "Quyết định này",
        "clauses": [
          {
            "no": "1",
            "text": "có hiệu lực kể từ ngày 01/10/2022. Chánh Văn phòng Bộ, Chánh Thanh tra Bộ, các Vụ trưởng, Cục trưởng Cục Đường bộ Việt Nam và Thủ trưởng các cơ quan, đơn vị có liên quan chịu trách nhiệm thi hành Quyết định này./. Nơi nhận: - Như",
            "points": []
          }
        ]
      },
      {
        "article": "Điều 3",
        "title": "; - Các Bộ: Nội vụ, Tài chính, Xây dựng, Kế hoạch và Đầu tư, Công an, Thông tin",
        "clauses": [
          {
            "no": "1",
            "text": "và Truyền thông; - Các Thứ trưởng Bộ GTVT; - UBND các tỉnh, thành phố trực thuộc Trung ương; - Tổng cục ĐBVN; - Công an các tỉnh, thành phố: Hà Nội, Nghệ An, Đà Nẵng, Hồ Chí Minh; - Các Ban QLDA: 3, 4, 5, 8; - Trung tâm Truyền thông và Thông tin đường bộ; - Kho bạc Nhà nước (nơi giao dịch); - Lưu: VT, TCCB (TA 05b). BỘ TRƯỞNG Nguyễn Văn Thể",
            "points": []
          }
        ]
      }
    ],
    "validation": {
      "status": "warning",
      "issues": [
        "Low content preservation: 48.38%"
      ],
      "stats": {
        "original_length": 2278,
        "segmented_length": 1102,
        "preservation_ratio": 0.48375768217734855,
        "total_articles": 6,
        "total_clauses": 6,
        "total_points": 0
      }
    },
    "document_type": "decree"
  }
}