{
  "doc_id": "12_2018_QĐ_UBND",
  "meta": {
    "url": "https://thuvienphapluat.vn/van-ban/Giao-thong-Van-tai/Quyet-dinh-12-2018-QD-UBND-trat-tu-an-toan-giao-thong-kiem-soat-tai-trong-Thai-Binh-396229.aspx",
    "crawl_time": "2025-10-15T11:00:11.212392",
    "number": "12/2018/QĐ-UBND",
    "field": "Giao thông",
    "issue_date": "24/09/2018",
    "agency": "ỦY BAN NHÂN DÂN TỈNH THÁI BÌNH",
    "content": "ỦY BAN NHÂN DÂN TỈNH THÁI BÌNH ------- CỘNG HÒA XÃ HỘI\r\n  CHỦ NGHĨA VIỆT NAM Độc lập - Tự do - Hạnh phúc --------------- Số:\r\n  12/2018/QĐ-UBND Thái Bình, ngày\r\n  24 tháng 09 năm 2018 QUYẾT ĐỊNH BAN\r\nHÀNH QUY CHẾ PHỐI HỢP TRONG CÔNG TÁC BẢO ĐẢM TRẬT TỰ AN TOÀN GIAO THÔNG, TRONG\r\nKIỂM SOÁT TẢI TRỌNG PHƯƠNG TIỆN, QUẢN LÝ HÀNH LANG AN TOÀN GIAO THÔNG TRÊN ĐỊA\r\nBÀN TỈNH THÁI BÌNH ỦY BAN NHÂN DÂN TỈNH THÁI BÌNH Căn cứ Luật Tổ chức chính quyền địa phương ngày 19/6/2015; Căn cứ Luật Ban hành văn bản quy phạm pháp luật\r\nngày 22/6/2015; Căn cứ Luật Giao thông đường bộ ngày 13/11/2008; Căn cứ Luật Giao thông đường thủy nội địa ngày\r\n15/6/2004 và Luật Sửa đổi, bổ sung một số điều của Luật Giao thông đường thủy nội\r\nđịa ngày 17/6/2014; Theo đề nghị của Giám đốc Sở Giao thông Vận tải\r\ntại Tờ trình số 85/TTr-SGTVT ngày 07 tháng 9 năm 2018. QUYẾT ĐỊNH: Điều 1. Ban hành kèm theo Quyết\r\nđịnh này Quy chế phối hợp trong công tác bảo đảm trật tự an toàn giao thông,\r\ntrong kiểm soát tải trọng phương tiện, quản lý hành lang an toàn giao thông\r\ntrên địa bàn tỉnh Thái Bình. Điều 2. Quyết định này có hiệu\r\nlực thi hành sau 10 ngày kể từ ngày ký. Ủy ban nhân dân các huyện, thành phố có\r\ntrách nhiệm triển khai Quy chế này đến các xã, phường, thị trấn thuộc huyện,\r\nthành phố. Điều 3. Chánh Văn phòng Ủy ban\r\nnhân dân tỉnh, các Giám đốc Sở, Thủ trưởng ban, ngành: An toàn giao thông tỉnh,\r\nGiao thông Vận tải, Công an, Tài chính, Giáo dục và Đào tạo, Tư pháp, Đài Phát\r\nthanh và Truyền hình Thái Bình, Bộ Chỉ huy Quân sự tỉnh; Chủ tịch Ủy ban nhân\r\ndân các huyện, thành phố và Thủ trưởng ngành, đơn vị có liên quan chịu trách\r\nnhiệm thi hành Quyết định này./. Nơi nhận: - Như Điều 3; - Văn phòng Chính phủ; - Ủy ban ATGT quốc gia; - Bộ Giao thông vận tải; - TT Hội đồng nhân dân tỉnh; - Chủ tịch, các PCT TBND tỉnh; - Cục Kiểm tra văn bản QPPL - Bộ Tư pháp; - LĐ VP UBND tỉnh; - Cổng TTĐT tỉnh; - Phòng CBTT, TH; - Lưu VT, CTXDGT. TM. ỦY BAN NHÂN\r\n  DÂN CHỦ TỊCH Đặng Trọng Thăng QUY CHẾ PHỐI\r\nHỢP TRONG CÔNG TÁC BẢO ĐẢM TRẬT TỰ AN TOÀN GIAO THÔNG, TRONG KIỂM SOÁT TẢI TRỌNG\r\nPHƯƠNG TIỆN, QUẢN LÝ HÀNH LANG AN TOÀN GIAO THÔNG TRÊN ĐỊA BÀN TỈNH THÁI BÌNH (Ban hành kèm theo Quyết định số 12/2018/QĐ-UBND ngày 24/9/2018 của Ủy ban\r\nnhân dân tỉnh Thái Bình) Chương I QUY ĐỊNH CHUNG Điều 1. Phạm vi điều chỉnh Quy chế này quy định mục tiêu, đối tượng, nguyên tắc,\r\nhình thức, nội dung và trách nhiệm của các đơn vị có liên quan trong công tác\r\nphối hợp bảo đảm trật tự an toàn giao thông (ATGT), trong kiểm soát tải trọng\r\nphương tiện, quản lý hành lang an toàn giao thông trên địa bàn tỉnh Thái Bình. Điều 2. Mục tiêu phối hợp 1. Tăng cường trách nhiệm, nâng cao hiệu quả hoạt động\r\ncủa các đơn vị theo chức năng, nhiệm vụ được giao và trong công tác phối hợp bảo\r\nđảm trật tự an toàn giao thông, trong kiểm soát tải trọng phương tiện, quản lý\r\nhành lang an toàn giao thông trên địa bàn tỉnh Thái Bình. 2. Bảo đảm sự thống nhất, huy động sức mạnh tổng hợp\r\ncủa cả hệ thống chính trị trong công tác bảo đảm trật tự an toàn giao thông,\r\ntrong kiểm soát tải trọng phương tiện, quản lý hành lang an toàn giao thông\r\ntrên địa bàn tỉnh nhằm góp phần đẩy lùi tình trạng mất trật tự an toàn giao\r\nthông, giảm thiểu tai nạn giao thông. Điều 3. Đối tượng áp dụng 1. Cấp tỉnh a) Ủy ban nhân dân tỉnh. b) Ban An toàn giao thông tỉnh. c) Các sở, ban, ngành, tổ chức đoàn thể chính trị -\r\nxã hội cấp tỉnh. 2. Cấp huyện, thành phố a) Ủy ban nhân dân huyện, thành phố. b) Ban An toàn giao thông huyện, thành phố. c) Các phòng, ban, đơn vị, tổ chức đoàn thể chính\r\ntrị - xã hội cấp huyện, thành phố. 3. Cấp xã, phường, thị trấn a) Ủy ban nhân dân xã, phường, thị trấn, b) Ban An toàn giao thông xã, phường, thị trấn c) Các tổ chức đoàn thể chính trị - xã hội. Điều 4. Nguyên tắc phối hợp 1. Các đơn vị căn cứ vào nội dung, trách nhiệm được\r\nphân công tại Điều 7; Điều 8; Điều 9; Điều 10 Quy định này chủ động xây dựng\r\nQuy chế phối hợp với các đơn vị khác cùng cấp có liên quan và xây dựng quy chế\r\nphối hợp trong nội bộ đơn vị. Quy chế phối hợp phải được gửi, báo cáo lên đơn vị\r\ncấp trên trực tiếp để theo dõi, giám sát, kiểm tra. 2. Các đơn vị được yêu cầu phối hợp theo đúng trách\r\nnhiệm được giao tại Điều 8; Điều 9; Điều 10 Quy định này mà không thực hiện phối\r\nhợp hoặc chậm trễ, tắc trách trong công tác phối hợp sẽ bị xem xét xử lý kỷ luật\r\ntheo quy định. 3. Trong quá trình phối hợp nếu phát sinh tình huống\r\nphức tạp, khó khăn trong việc xử lý thì phải báo cáo lên cấp trên trực tiếp để\r\nchỉ đạo xử lý. 4. Sự phối hợp phải đảm bảo tính thống nhất về kế\r\nhoạch chỉ đạo, thực hiện phân công nhiệm vụ, phân giao trách nhiệm rõ ràng\r\ntrong quá trình phối hợp. Điều 5. Hình thức phối hợp 1. Phối hợp theo Quy chế, chương trình, kế hoạch bảo\r\nđảm trật tự ATGT đã định sẵn hoặc phối hợp đột xuất theo yêu cầu công việc. 2. Phối hợp theo chuyên đề, hội thảo, hội nghị các\r\nnội dung, lĩnh vực trong Điều 7 Quy định này. 3. Sở Giao thông Vận tải và Công an tỉnh ngoài việc\r\nxây dựng Quy chế phối hợp theo Quy chế này còn phải t"
  },
  "structure": {
    "articles": [
      {
        "article": "Điều 1",
        "title": "Ban hành kèm theo Quyết",
        "clauses": [
          {
            "no": "1",
            "text": "định này Quy chế phối hợp trong công tác bảo đảm trật tự an toàn giao thông, trong kiểm soát tải trọng phương tiện, quản lý hành lang an toàn giao thông trên địa bàn tỉnh Thái Bình.",
            "points": []
          }
        ]
      },
      {
        "article": "Điều 2",
        "title": "Quyết định này có hiệu",
        "clauses": [
          {
            "no": "1",
            "text": "lực thi hành sau 10 ngày kể từ ngày ký. Ủy ban nhân dân các huyện, thành phố có trách nhiệm triển khai Quy chế này đến các xã, phường, thị trấn thuộc huyện, thành phố.",
            "points": []
          }
        ]
      },
      {
        "article": "Điều 3",
        "title": "Chánh Văn phòng Ủy ban",
        "clauses": [
          {
            "no": "1",
            "text": "nhân dân tỉnh, các Giám đốc Sở, Thủ trưởng ban, ngành: An toàn giao thông tỉnh, Giao thông Vận tải, Công an, Tài chính, Giáo dục và Đào tạo, Tư pháp, Đài Phát thanh và Truyền hình Thái Bình, Bộ Chỉ huy Quân sự tỉnh; Chủ tịch Ủy ban nhân dân các huyện, thành phố và Thủ trưởng ngành, đơn vị có liên quan chịu trách nhiệm thi hành Quyết định này./. Nơi nhận: - Như",
            "points": []
          }
        ]
      },
      {
        "article": "Điều 3",
        "title": "; - Văn phòng Chính phủ; - Ủy ban ATGT quốc gia; - Bộ Giao thông vận tải; - TT Hội đồng nhân dân tỉnh; - Chủ tịch, các PCT TBND tỉnh; - Cục Kiểm tra văn bản QPPL - Bộ Tư pháp; - LĐ VP UBND tỉnh; - Cổng TTĐT tỉnh; - Phòng CBTT, TH; - Lưu VT, CTXDGT. TM. ỦY BAN NHÂN",
        "clauses": [
          {
            "no": "1",
            "text": "DÂN CHỦ TỊCH Đặng Trọng Thăng QUY CHẾ PHỐI HỢP TRONG CÔNG TÁC BẢO ĐẢM TRẬT TỰ AN TOÀN GIAO THÔNG, TRONG KIỂM SOÁT TẢI TRỌNG PHƯƠNG TIỆN, QUẢN LÝ HÀNH LANG AN TOÀN GIAO THÔNG TRÊN ĐỊA BÀN TỈNH THÁI BÌNH (Ban hành kèm theo Quyết định số 12/2018/QĐ-UBND ngày 24/9/2018 của Ủy ban nhân dân tỉnh Thái Bình) Chương I QUY ĐỊNH CHUNG",
            "points": []
          }
        ]
      },
      {
        "article": "Điều 1",
        "title": "Phạm vi điều chỉnh Quy chế này quy định mục tiêu, đối tượng, nguyên tắc,",
        "clauses": [
          {
            "no": "1",
            "text": "hình thức, nội dung và trách nhiệm của các đơn vị có liên quan trong công tác phối hợp bảo đảm trật tự an toàn giao thông (ATGT), trong kiểm soát tải trọng phương tiện, quản lý hành lang an toàn giao thông trên địa bàn tỉnh Thái Bình.",
            "points": []
          }
        ]
      },
      {
        "article": "Điều 2",
        "title": "Mục tiêu phối hợp 1. Tăng cường trách nhiệm, nâng cao hiệu quả hoạt động",
        "clauses": [
          {
            "no": "1",
            "text": "của các đơn vị theo chức năng, nhiệm vụ được giao và trong công tác phối hợp bảo đảm trật tự an toàn giao thông, trong kiểm soát tải trọng phương tiện, quản lý hành lang an toàn giao thông trên địa bàn tỉnh Thái Bình. 2. Bảo đảm sự thống nhất, huy động sức mạnh tổng hợp của cả hệ thống chính trị trong công tác bảo đảm trật tự an toàn giao thông, trong kiểm soát tải trọng phương tiện, quản lý hành lang an toàn giao thông trên địa bàn tỉnh nhằm góp phần đẩy lùi tình trạng mất trật tự an toàn giao thông, giảm thiểu tai nạn giao thông.",
            "points": []
          }
        ]
      },
      {
        "article": "Điều 3",
        "title": "Đối tượng áp dụng 1. Cấp tỉnh a) Ủy ban nhân dân tỉnh. b) Ban An toàn giao thông tỉnh. c) Các sở, ban, ngành, tổ chức đoàn thể chính trị -",
        "clauses": [
          {
            "no": "1",
            "text": "xã hội cấp tỉnh. 2. Cấp huyện, thành phố a) Ủy ban nhân dân huyện, thành phố. b) Ban An toàn giao thông huyện, thành phố. c) Các phòng, ban, đơn vị, tổ chức đoàn thể chính trị - xã hội cấp huyện, thành phố. 3. Cấp xã, phường, thị trấn a) Ủy ban nhân dân xã, phường, thị trấn, b) Ban An toàn giao thông xã, phường, thị trấn c) Các tổ chức đoàn thể chính trị - xã hội.",
            "points": []
          }
        ]
      },
      {
        "article": "Điều 4",
        "title": "Nguyên tắc phối hợp 1. Các đơn vị căn cứ vào nội dung, trách nhiệm được",
        "clauses": [
          {
            "no": "1",
            "text": "phân công tại",
            "points": []
          }
        ]
      },
      {
        "article": "Điều 7",
        "title": ";",
        "clauses": []
      },
      {
        "article": "Điều 8",
        "title": ";",
        "clauses": []
      },
      {
        "article": "Điều 9",
        "title": ";",
        "clauses": []
      },
      {
        "article": "Điều 10",
        "title": "Quy định này chủ động xây dựng",
        "clauses": [
          {
            "no": "1",
            "text": "Quy chế phối hợp với các đơn vị khác cùng cấp có liên quan và xây dựng quy chế phối hợp trong nội bộ đơn vị. Quy chế phối hợp phải được gửi, báo cáo lên đơn vị cấp trên trực tiếp để theo dõi, giám sát, kiểm tra. 2. Các đơn vị được yêu cầu phối hợp theo đúng trách nhiệm được giao tại",
            "points": []
          }
        ]
      },
      {
        "article": "Điều 8",
        "title": ";",
        "clauses": []
      },
      {
        "article": "Điều 9",
        "title": ";",
        "clauses": []
      },
      {
        "article": "Điều 10",
        "title": "Quy định này mà không thực hiện phối",
        "clauses": [
          {
            "no": "1",
            "text": "hợp hoặc chậm trễ, tắc trách trong công tác phối hợp sẽ bị xem xét xử lý kỷ luật theo quy định. 3. Trong quá trình phối hợp nếu phát sinh tình huống phức tạp, khó khăn trong việc xử lý thì phải báo cáo lên cấp trên trực tiếp để chỉ đạo xử lý. 4. Sự phối hợp phải đảm bảo tính thống nhất về kế hoạch chỉ đạo, thực hiện phân công nhiệm vụ, phân giao trách nhiệm rõ ràng trong quá trình phối hợp.",
            "points": []
          }
        ]
      },
      {
        "article": "Điều 5",
        "title": "Hình thức phối hợp 1. Phối hợp theo Quy chế, chương trình, kế hoạch bảo",
        "clauses": [
          {
            "no": "1",
            "text": "đảm trật tự ATGT đã định sẵn hoặc phối hợp đột xuất theo yêu cầu công việc. 2. Phối hợp theo chuyên đề, hội thảo, hội nghị các nội dung, lĩnh vực trong",
            "points": []
          }
        ]
      },
      {
        "article": "Điều 7",
        "title": "Quy định này. 3. Sở Giao thông Vận tải và Công an tỉnh ngoài việc",
        "clauses": [
          {
            "no": "1",
            "text": "xây dựng Quy chế phối hợp theo Quy chế này còn phải t",
            "points": []
          }
        ]
      }
    ],
    "strategy_used": "dieu",
    "validation": {
      "status": "warning",
      "issues": [
        "Low content preservation: 61.98%"
      ],
      "stats": {
        "original_length": 4945,
        "segmented_length": 3065,
        "preservation_ratio": 0.6198179979777553,
        "total_articles": 17,
        "total_clauses": 12,
        "total_points": 0
      }
    },
    "document_type": "law"
  }
}