{
  "doc_id": "24_2022_QĐ_UBND",
  "meta": {
    "url": "https://thuvienphapluat.vn/van-ban/Giao-thong-Van-tai/Quyet-dinh-24-2022-QD-UBND-quan-ly-duong-bo-thuoc-he-thong-duong-dia-phuong-An-Giang-521571.aspx",
    "crawl_time": "2025-10-15T14:07:46.615019",
    "number": "24/2022/QĐ-UBND",
    "field": "Giao thông",
    "issue_date": "21/06/2022",
    "agency": "ỦY BAN NHÂN DÂN TỈNH AN GIANG",
    "content": "ỦY BAN NHÂN DÂN TỈNH AN GIANG ------- CỘNG HÒA XÃ HỘI\r\n  CHỦ NGHĨA VIỆT NAM Độc lập - Tự do - Hạnh phúc --------------- Số:\r\n  24/2022/QĐ-UBND An Giang, ngày 21\r\n  tháng 6 năm 2022 QUYẾT ĐỊNH BAN HÀNH QUY ĐỊNH VỀ QUẢN LÝ, VẬN HÀNH KHAI THÁC VÀ BẢO TRÌ\r\nCÔNG TRÌNH ĐƯỜNG BỘ THUỘC HỆ THỐNG ĐƯỜNG ĐỊA PHƯƠNG TRÊN ĐỊA BÀN TỈNH AN GIANG ỦY BAN NHÂN DÂN TỈNH AN GIANG Căn cứ Luật Tổ chức chính\r\nquyền địa phương ngày 19 tháng 6 năm 2015; Luật Sửa đổi, bổ sung một số điều của\r\nLuật Tổ chức Chính phủ và Luật Tổ chức chính quyền địa phương ngày 22 tháng 11\r\nnăm 2019; Căn cứ Luật Ban hành văn bản\r\nquy phạm pháp luật ngày 22 tháng 6 năm 2015; Luật Sửa đổi, bổ sung một số\r\nđiều của Luật Ban hành văn bản quy phạm pháp luật ngày 18 tháng 6 năm 2020; Căn cứ Luật Giao thông đường\r\nbộ ngày 13 tháng 11 năm 2008; Căn cứ Nghị định số 11/2010/NĐ-CP ngày 24 tháng 02 năm 2010 của Chính phủ quy định về quản\r\nlý và bảo vệ kết cấu hạ tầng giao thông đường bộ; Căn cứ Nghị định số 100/2013/NĐ-CP ngày 03 tháng 9 năm 2013 của Chính phủ sửa đổi, bổ sung một số điều của\r\nNghị định số 11/2010/NĐ-CP ngày 24 tháng 02 năm 2010 của Chính phủ quy định\r\nvề quản lý và bảo vệ kết cấu hạ tầng giao thông đường bộ; Căn cứ Nghị định số 06/2021/NĐ-CP ngày 26 tháng 01 năm 2021 của Chính phủ quy định chi tiết một số\r\nnội dung về quản lý chất lượng, thi công xây dựng và bảo trì công trình xây dựng; Căn cứ Thông tư số 37/2018/TT-BGTVT ngày 07 tháng 6 năm 2018 của Bộ trưởng Bộ Giao thông vận tải\r\nquy định về quản lý, vận hành khai thác và bảo trì công trình đường bộ; Căn cứ Thông tư số 41/2021/TT-BGTVT ngày 31 tháng 12 năm 2021 của Bộ trưởng Bộ Giao thông vận\r\ntải sửa đổi, bổ sung một số điều của Thông tư số 37/2018/TT-BGTVT ngày\r\n07 tháng 6 năm 2018 của Bộ trưởng Bộ Giao thông vận tải quy định về quản lý, vận\r\nhành khai thác và bảo trì công trình đường bộ; Theo đề nghị của Giám đốc Sở\r\nGiao thông vận tải tại Tờ trình số 1050/TTr- SGTVT ngày 24 tháng 5 năm 2022. QUYẾT ĐỊNH: Điều 1. Ban hành kèm theo Quyết định này Quy định về quản lý,\r\nvận hành khai thác và bảo trì công trình đường bộ thuộc hệ thống đường địa\r\nphương trên địa bàn tỉnh An Giang. Điều 2. Quyết định này có hiệu lực từ ngày 04 tháng 7 năm\r\n2022 và thay thế Quyết định số 07/2011/QĐ-UBND ngày 14 tháng 3 năm 2011 của Ủy\r\nban nhân dân tỉnh An Giang ban hành Quy định về quản lý, bảo trì hệ thống đường\r\nhuyện, đường xã trên địa bàn tỉnh An Giang. Điều 3. Chánh Văn phòng Ủy ban nhân dân tỉnh; Giám đốc Sở\r\nGiao thông vận tải; Giám đốc Sở Xây dựng; Thủ trưởng các sở, ban, ngành tỉnh;\r\nChủ tịch Ủy ban nhân dân huyện, thị xã, thành phố và các tổ chức, cá nhân có\r\nliên quan chịu trách nhiệm thi hành Quyết định này./. Nơi nhận: - Như Điều 3; - Bộ Giao thông vận tải; - Cục Kiểm tra VBQPPL - Bộ Tư pháp; - TT. TU, HĐND tỉnh, UBMTTQVN tỉnh; - Chủ tịch và các PCT UBND tỉnh; - Các sở, ban, ngành tỉnh; - UBND huyện, thị xã, thành phố; - Cổng thông tin điện tử tỉnh; - VP. UBND tỉnh: Lãnh đạo VP, các phòng, ban và trung tâm; - Lưu: VT. TM. ỦY BAN NHÂN\r\n  DÂN CHỦ TỊCH Nguyễn Thanh Bình QUY ĐỊNH VỀ QUẢN LÝ, VẬN HÀNH KHAI THÁC VÀ BẢO TRÌ CÔNG TRÌNH ĐƯỜNG BỘ\r\nTHUỘC HỆ THỐNG ĐƯỜNG ĐỊA PHƯƠNG TRÊN ĐỊA BÀN TỈNH AN GIANG (Kèm theo Quyết định số 24/2022/QĐ-UBND ngày 21 tháng 6 năm 2022 của Ủy\r\nban nhân dân tỉnh An Giang) Chương I NHỮNG QUY ĐỊNH CHUNG Điều 1.\r\nPhạm vi điều chỉnh Quy định về quản lý, vận hành\r\nkhai thác và bảo trì công trình đường bộ thuộc hệ thống đường địa phương bao gồm\r\nđường tỉnh, đường huyện, đường xã, đường đô thị và đường chuyên dùng trên địa\r\nbàn tỉnh An Giang. Điều 2. Đối\r\ntượng áp dụng Quy định này áp dụng đối với\r\ncác cơ quan, tổ chức, cá nhân có liên quan đến công tác quản lý, vận hành khai\r\nthác và bảo trì công trình đường bộ thuộc hệ thống đường địa phương trên địa\r\nbàn tỉnh An Giang. Chương II QUẢN LÝ, KHAI THÁC VÀ BẢO\r\nTRÌ CÔNG TRÌNH ĐƯỜNG BỘ TRÊN ĐỊA BÀN TỈNH AN GIANG Điều 3.\r\nYêu cầu về quản lý, khai thác, bảo trì công trình đường bộ Yêu cầu về quản lý, khai thác, bảo\r\ntrì công trình đường bộ thực hiện theo quy định tại Điều 3 Thông tư số 37/2018/TT-BGTVT ngày 07 tháng 6 năm 2018 của Bộ trưởng Bộ Giao thông vận tải\r\nquy định về quản lý, vận hành khai thác và bảo trì công trình đường bộ và khoản\r\n2 Điều 1 Thông tư số 41/2021/TT-BGTVT ngày 31 tháng 12 năm 2021 của Bộ trưởng Bộ\r\nGiao thông vận tải sửa đổi, bổ sung một số điều của Thông tư số 37/2018/TT-BGTVT ngày 07 tháng 6 năm 2018 của Bộ trưởng Bộ Giao thông vận tải\r\nquy định về quản lý, vận hành khai thác và bảo trì công trình đường bộ. Điều 4. Nội\r\ndung bảo trì công trình đường bộ Thực hiện theo quy định tại Điều\r\n4 Thông tư số 37/2018/TT-BGTVT và khoản 3 Điều 1 Thông tư số 41/2021/TT-BGTVT . Điều 5.\r\nTrách nhiệm quản lý, khai thác vận hành và bảo trì công trình đường bộ 1. Sở Giao thông vận tải quản\r\nlý, vận hành khai thác và bảo trì đối với đường tỉnh và các tuyến đường do Ủy\r\nban nhân dân tỉnh giao quản lý. 2. Ủy ban nhân dân cấp huyện quản\r\nlý, vận hành khai thác và bảo trì đối với đường huyện, đường đô thị (trừ những\r\nđoạn đường Quốc lộ, đ"
  },
  "structure": {
    "articles": [
      {
        "article": "Điều 1",
        "title": "Ban hành kèm theo Quyết định này Quy định về quản lý,",
        "clauses": [
          {
            "no": "1",
            "text": "vận hành khai thác và bảo trì công trình đường bộ thuộc hệ thống đường địa phương trên địa bàn tỉnh An Giang.",
            "points": []
          }
        ]
      },
      {
        "article": "Điều 2",
        "title": "Quyết định này có hiệu lực từ ngày 04 tháng 7 năm",
        "clauses": [
          {
            "no": "1",
            "text": "2022 và thay thế Quyết định số 07/2011/QĐ-UBND ngày 14 tháng 3 năm 2011 của Ủy ban nhân dân tỉnh An Giang ban hành Quy định về quản lý, bảo trì hệ thống đường huyện, đường xã trên địa bàn tỉnh An Giang.",
            "points": []
          }
        ]
      },
      {
        "article": "Điều 3",
        "title": "Chánh Văn phòng Ủy ban nhân dân tỉnh; Giám đốc Sở",
        "clauses": [
          {
            "no": "1",
            "text": "Giao thông vận tải; Giám đốc Sở Xây dựng; Thủ trưởng các sở, ban, ngành tỉnh; Chủ tịch Ủy ban nhân dân huyện, thị xã, thành phố và các tổ chức, cá nhân có liên quan chịu trách nhiệm thi hành Quyết định này./. Nơi nhận: - Như",
            "points": []
          }
        ]
      },
      {
        "article": "Điều 3",
        "title": "; - Bộ Giao thông vận tải; - Cục Kiểm tra VBQPPL - Bộ Tư pháp; - TT. TU, HĐND tỉnh, UBMTTQVN tỉnh; - Chủ tịch và các PCT UBND tỉnh; - Các sở, ban, ngành tỉnh; - UBND huyện, thị xã, thành phố; - Cổng thông tin điện tử tỉnh; - VP. UBND tỉnh: Lãnh đạo VP, các phòng, ban và trung tâm; - Lưu: VT. TM. ỦY BAN NHÂN",
        "clauses": [
          {
            "no": "1",
            "text": "DÂN CHỦ TỊCH Nguyễn Thanh Bình QUY ĐỊNH VỀ QUẢN LÝ, VẬN HÀNH KHAI THÁC VÀ BẢO TRÌ CÔNG TRÌNH ĐƯỜNG BỘ THUỘC HỆ THỐNG ĐƯỜNG ĐỊA PHƯƠNG TRÊN ĐỊA BÀN TỈNH AN GIANG (Kèm theo Quyết định số 24/2022/QĐ-UBND ngày 21 tháng 6 năm 2022 của Ủy ban nhân dân tỉnh An Giang) Chương I NHỮNG QUY ĐỊNH CHUNG",
            "points": []
          }
        ]
      },
      {
        "article": "Điều 1",
        "title": "Phạm vi điều chỉnh Quy định về quản lý, vận hành",
        "clauses": [
          {
            "no": "1",
            "text": "khai thác và bảo trì công trình đường bộ thuộc hệ thống đường địa phương bao gồm đường tỉnh, đường huyện, đường xã, đường đô thị và đường chuyên dùng trên địa bàn tỉnh An Giang.",
            "points": []
          }
        ]
      },
      {
        "article": "Điều 2",
        "title": "Đối",
        "clauses": [
          {
            "no": "1",
            "text": "tượng áp dụng Quy định này áp dụng đối với các cơ quan, tổ chức, cá nhân có liên quan đến công tác quản lý, vận hành khai thác và bảo trì công trình đường bộ thuộc hệ thống đường địa phương trên địa bàn tỉnh An Giang. Chương II QUẢN LÝ, KHAI THÁC VÀ BẢO TRÌ CÔNG TRÌNH ĐƯỜNG BỘ TRÊN ĐỊA BÀN TỈNH AN GIANG",
            "points": []
          }
        ]
      },
      {
        "article": "Điều 3",
        "title": "Yêu cầu về quản lý, khai thác, bảo trì công trình đường bộ Yêu cầu về quản lý, khai thác, bảo",
        "clauses": [
          {
            "no": "1",
            "text": "trì công trình đường bộ thực hiện theo quy định tại",
            "points": []
          }
        ]
      },
      {
        "article": "Điều 3",
        "title": "Thông tư số 37/2018/TT-BGTVT ngày 07 tháng 6 năm 2018 của Bộ trưởng Bộ Giao thông vận tải",
        "clauses": [
          {
            "no": "1",
            "text": "quy định về quản lý, vận hành khai thác và bảo trì công trình đường bộ và khoản 2",
            "points": []
          }
        ]
      },
      {
        "article": "Điều 1",
        "title": "Thông tư số 41/2021/TT-BGTVT ngày 31 tháng 12 năm 2021 của Bộ trưởng Bộ",
        "clauses": [
          {
            "no": "1",
            "text": "Giao thông vận tải sửa đổi, bổ sung một số điều của Thông tư số 37/2018/TT-BGTVT ngày 07 tháng 6 năm 2018 của Bộ trưởng Bộ Giao thông vận tải quy định về quản lý, vận hành khai thác và bảo trì công trình đường bộ.",
            "points": []
          }
        ]
      },
      {
        "article": "Điều 4",
        "title": "Nội",
        "clauses": [
          {
            "no": "1",
            "text": "dung bảo trì công trình đường bộ Thực hiện theo quy định tại",
            "points": []
          }
        ]
      },
      {
        "article": "Điều 4",
        "title": "Thông tư số 37/2018/TT-BGTVT và khoản 3",
        "clauses": []
      },
      {
        "article": "Điều 1",
        "title": "Thông tư số 41/2021/TT-BGTVT .",
        "clauses": []
      },
      {
        "article": "Điều 5",
        "title": "Trách nhiệm quản lý, khai thác vận hành và bảo trì công trình đường bộ 1. Sở Giao thông vận tải quản",
        "clauses": [
          {
            "no": "1",
            "text": "lý, vận hành khai thác và bảo trì đối với đường tỉnh và các tuyến đường do Ủy ban nhân dân tỉnh giao quản lý. 2. Ủy ban nhân dân cấp huyện quản lý, vận hành khai thác và bảo trì đối với đường huyện, đường đô thị (trừ những đoạn đường Quốc lộ, đ",
            "points": []
          }
        ]
      }
    ],
    "strategy_used": "dieu",
    "validation": {
      "status": "warning",
      "issues": [
        "Low content preservation: 39.54%"
      ],
      "stats": {
        "original_length": 4944,
        "segmented_length": 1955,
        "preservation_ratio": 0.39542880258899676,
        "total_articles": 13,
        "total_clauses": 11,
        "total_points": 0
      }
    },
    "document_type": "law"
  }
}