{
  "doc_id": "36_2022_TT_BGTVT",
  "meta": {
    "url": "https://thuvienphapluat.vn/van-ban/Bo-may-hanh-chinh/Thong-tu-36-2022-TT-BGTVT-vi-tri-viec-lam-lanh-dao-quan-ly-nganh-giao-thong-van-tai-548494.aspx",
    "crawl_time": "2025-10-15T10:14:55.265440",
    "number": "36/2022/TT-BGTVT",
    "field": "Giao thông",
    "issue_date": "30/12/2022",
    "agency": "BỘ GIAO THÔNG VẬN",
    "content": "BỘ GIAO THÔNG VẬN\r\n  TẢI ------- CỘNG HÒA XÃ HỘI\r\n  CHỦ NGHĨA VIỆT NAM Độc lập - Tự do - Hạnh phúc --------------- Số:\r\n  36/2022/TT-BGTVT Hà Nội, ngày 30\r\n  tháng 12 năm 2022 THÔNG TƯ HƯỚNG DẪN VỀ VỊ TRÍ VIỆC LÀM LÃNH ĐẠO, QUẢN LÝ VÀ CHỨC DANH\r\nNGHỀ NGHIỆP CHUYÊN NGÀNH GIAO THÔNG VẬN TẢI TRONG ĐƠN VỊ SỰ NGHIỆP CÔNG LẬP; CƠ\r\nCẤU VIÊN CHỨC THEO CHỨC DANH NGHỀ NGHIỆP TRONG ĐƠN VỊ SỰ NGHIỆP CÔNG LẬP THUỘC\r\nNGÀNH, LĨNH VỰC GIAO THÔNG VẬN TẢI Căn cứ Nghị định số 106/2020/NĐ-CP ngày 10 tháng 9 năm 2020 của Chính phủ quy định về vị trí việc\r\nlàm, số lượng người làm việc trong đơn vị sự nghiệp công lập; Căn cứ Nghị định số 56/2022/NĐ-CP ngày 24 tháng 8 năm 2022 của Chính phủ quy định chức năng, nhiệm\r\nvụ, quyền hạn và cơ cấu tổ chức của Bộ Giao thông vận tải; Theo đề nghị của Vụ trưởng Vụ\r\nTổ chức cán bộ; Bộ trưởng Bộ Giao thông vận\r\ntải ban hành Thông tư hướng dẫn về vị trí việc làm lãnh đạo, quản lý và chức\r\ndanh nghề nghiệp chuyên ngành giao thông vận tải trong đơn vị sự nghiệp công lập;\r\ncơ cấu viên chức theo chức danh nghề nghiệp trong đơn vị sự nghiệp công lập thuộc\r\nngành, lĩnh vực giao thông vận tải. Điều 1. Phạm\r\nvi điều chỉnh Thông tư này hướng dẫn về danh\r\nmục vị trí việc làm, bản mô tả công việc, khung năng lực của vị trí việc làm\r\nlãnh đạo, quản lý và vị trí việc làm chức danh nghề nghiệp viên chức chuyên\r\nngành giao thông vận tải trong đơn vị sự nghiệp công lập; cơ cấu viên chức theo\r\nchức danh nghề nghiệp trong đơn vị sự nghiệp công lập thuộc ngành, lĩnh vực\r\ngiao thông vận tải. Điều 2. Đối\r\ntượng áp dụng 1. Thông tư này áp dụng đối với\r\ncác đơn vị sự nghiệp công lập thuộc ngành, lĩnh vực giao thông vận tải thuộc bộ,\r\ncơ quan ngang bộ (trừ Bộ Công an, Bộ Quốc phòng), Ủy ban nhân dân tỉnh, thành\r\nphố trực thuộc Trung ương, Ủy ban nhân dân huyện, quận, thị xã, thành phố thuộc\r\ntỉnh, thành phố trực thuộc Trung ương (trừ đơn vị sự nghiệp công lập thuộc phạm\r\nvi quản lý của chính quyền đơn vị hành chính - kinh tế đặc biệt) và các tổ chức,\r\ncá nhân có liên quan. 2. Các đơn vị sự nghiệp ngoài\r\ncông lập được áp dụng quy định tại Thông tư này. Điều 3.\r\nNguyên tắc và căn cứ xác định vị trí việc làm lãnh đạo, quản lý và vị trí việc\r\nlàm chức danh nghề nghiệp viên chức chuyên ngành 1. Vị trí việc làm lãnh đạo, quản\r\nlý và vị trí việc làm chức danh nghề nghiệp viên chức chuyên ngành trong các\r\nđơn vị sự nghiệp công lập được xác định theo nguyên tắc quy định tại Điều 3 Nghị định số 106/2020/NĐ-CP ngày 10 tháng 9 năm 2020 của\r\nChính phủ về vị trí việc làm và số lượng người làm việc trong đơn vị sự nghiệp\r\ncông lập. 2. Căn cứ xác định vị trí việc\r\nlàm lãnh đạo, quản lý và vị trí việc làm chức danh nghề nghiệp viên chức chuyên\r\nngành trong các đơn vị sự nghiệp công lập thực hiện theo quy định tại khoản 1 Điều 4 Nghị định số 106/2020/NĐ-CP ngày 10 tháng 9 năm\r\n2020 của Chính phủ về vị trí việc làm và số lượng người làm việc trong đơn vị sự\r\nnghiệp công lập. Điều 4. Vị\r\ntrí việc làm lãnh đạo, quản lý 1. Danh mục, bản mô tả công việc\r\ncủa vị trí việc làm lãnh đạo, quản lý theo quy định tại Phụ lục I ban hành kèm\r\ntheo Thông tư này. 2. Khung năng lực của vị trí việc\r\nlàm lãnh đạo, quản lý theo quy định tại Phụ lục II ban hành kèm theo Thông tư\r\nnày. Điều 5. Vị\r\ntrí việc làm chức danh nghề nghiệp viên chức chuyên ngành giao thông vận tải 1. Danh mục, bản mô tả công việc\r\ncủa vị trí việc làm chức danh nghề nghiệp viên chức chuyên ngành giao thông vận\r\ntải theo quy định tại Phụ lục III ban hành kèm theo Thông tư này. 2. Khung năng lực của vị trí việc\r\nlàm chức danh nghề nghiệp viên chức chuyên ngành giao thông vận tải theo quy định\r\ntại Phụ lục IV ban hành kèm theo Thông tư này. Điều 6. Cơ\r\ncấu viên chức theo chức danh nghề nghiệp Việc xác định cơ cấu viên chức\r\ntheo chức danh nghề nghiệp được thực hiện theo quy định tại khoản\r\n5 Điều 3, khoản 3 Điều 4 Nghị định số 106/2020/NĐ-CP ngày 10 tháng 9 năm\r\n2020 của Chính phủ về vị trí việc làm và số lượng người làm việc trong đơn vị sự\r\nnghiệp công lập. Điều 7. Điều\r\nkhoản chuyển tiếp Đối với viên chức hiện đang giữ\r\nngạch công chức hoặc hạng chức danh nghề nghiệp viên chức cao hơn so với hạng\r\nchức danh nghề nghiệp viên chức theo yêu cầu của vị trí việc làm được quy định\r\ntại Thông tư này trước ngày Thông tư này có hiệu lực thì tiếp tục được giữ ngạch\r\ncông chức hoặc hạng chức danh nghề nghiệp và bậc lương hiện giữ cho đến khi có\r\nhướng dẫn mới về chế độ tiền lương theo quy định. Điều 8. Hiệu\r\nlực thi hành 1. Thông tư này có hiệu lực thi\r\nhành kể từ ngày 01 tháng 3 năm 2023. 2. Trường hợp các văn bản quy\r\nphạm pháp luật dẫn chiếu tại Thông tư này được sửa đổi, bổ sung hoặc thay thế\r\nthì thực hiện theo quy định tại các văn bản sửa đổi, bổ sung, thay thế đó. Điều 9. Tổ\r\nchức thực hiện Chánh Văn phòng Bộ, Chánh Thanh\r\ntra Bộ, các Vụ trưởng, Thủ trưởng các cơ quan, đơn vị và tổ chức, cá nhân có\r\nliên quan chịu trách nhiệm thi hành Thông tư này./. Nơi nhận: - Văn phòng Chính phủ; - Các Bộ, cơ quan ngang Bộ; - Ủy ban nhân dân các tỉnh, thành phố trực thuộc Trung ương; - Bộ trưởng Bộ G"
  },
  "structure": {
    "articles": [
      {
        "article": "Điều 1",
        "title": "Phạm",
        "clauses": [
          {
            "no": "1",
            "text": "vi điều chỉnh Thông tư này hướng dẫn về danh mục vị trí việc làm, bản mô tả công việc, khung năng lực của vị trí việc làm lãnh đạo, quản lý và vị trí việc làm chức danh nghề nghiệp viên chức chuyên ngành giao thông vận tải trong đơn vị sự nghiệp công lập; cơ cấu viên chức theo chức danh nghề nghiệp trong đơn vị sự nghiệp công lập thuộc ngành, lĩnh vực giao thông vận tải.",
            "points": []
          }
        ]
      },
      {
        "article": "Điều 2",
        "title": "Đối",
        "clauses": [
          {
            "no": "1",
            "text": "tượng áp dụng 1. Thông tư này áp dụng đối với các đơn vị sự nghiệp công lập thuộc ngành, lĩnh vực giao thông vận tải thuộc bộ, cơ quan ngang bộ (trừ Bộ Công an, Bộ Quốc phòng), Ủy ban nhân dân tỉnh, thành phố trực thuộc Trung ương, Ủy ban nhân dân huyện, quận, thị xã, thành phố thuộc tỉnh, thành phố trực thuộc Trung ương (trừ đơn vị sự nghiệp công lập thuộc phạm vi quản lý của chính quyền đơn vị hành chính - kinh tế đặc biệt) và các tổ chức, cá nhân có liên quan. 2. Các đơn vị sự nghiệp ngoài công lập được áp dụng quy định tại Thông tư này.",
            "points": []
          }
        ]
      },
      {
        "article": "Điều 3",
        "title": "Nguyên tắc và căn cứ xác định vị trí việc làm lãnh đạo, quản lý và vị trí việc",
        "clauses": [
          {
            "no": "1",
            "text": "làm chức danh nghề nghiệp viên chức chuyên ngành 1. Vị trí việc làm lãnh đạo, quản lý và vị trí việc làm chức danh nghề nghiệp viên chức chuyên ngành trong các đơn vị sự nghiệp công lập được xác định theo nguyên tắc quy định tại",
            "points": []
          }
        ]
      },
      {
        "article": "Điều 3",
        "title": "Nghị định số 106/2020/NĐ-CP ngày 10 tháng 9 năm 2020 của",
        "clauses": [
          {
            "no": "1",
            "text": "Chính phủ về vị trí việc làm và số lượng người làm việc trong đơn vị sự nghiệp công lập. 2. Căn cứ xác định vị trí việc làm lãnh đạo, quản lý và vị trí việc làm chức danh nghề nghiệp viên chức chuyên ngành trong các đơn vị sự nghiệp công lập thực hiện theo quy định tại khoản 1",
            "points": []
          }
        ]
      },
      {
        "article": "Điều 4",
        "title": "Nghị định số 106/2020/NĐ-CP ngày 10 tháng 9 năm",
        "clauses": [
          {
            "no": "1",
            "text": "2020 của Chính phủ về vị trí việc làm và số lượng người làm việc trong đơn vị sự nghiệp công lập.",
            "points": []
          }
        ]
      },
      {
        "article": "Điều 4",
        "title": "Vị",
        "clauses": [
          {
            "no": "1",
            "text": "trí việc làm lãnh đạo, quản lý 1. Danh mục, bản mô tả công việc của vị trí việc làm lãnh đạo, quản lý theo quy định tại Phụ lục I ban hành kèm theo Thông tư này. 2. Khung năng lực của vị trí việc làm lãnh đạo, quản lý theo quy định tại Phụ lục II ban hành kèm theo Thông tư này.",
            "points": []
          }
        ]
      },
      {
        "article": "Điều 5",
        "title": "Vị",
        "clauses": [
          {
            "no": "1",
            "text": "trí việc làm chức danh nghề nghiệp viên chức chuyên ngành giao thông vận tải 1. Danh mục, bản mô tả công việc của vị trí việc làm chức danh nghề nghiệp viên chức chuyên ngành giao thông vận tải theo quy định tại Phụ lục III ban hành kèm theo Thông tư này. 2. Khung năng lực của vị trí việc làm chức danh nghề nghiệp viên chức chuyên ngành giao thông vận tải theo quy định tại Phụ lục IV ban hành kèm theo Thông tư này.",
            "points": []
          }
        ]
      },
      {
        "article": "Điều 6",
        "title": "Cơ",
        "clauses": [
          {
            "no": "1",
            "text": "cấu viên chức theo chức danh nghề nghiệp Việc xác định cơ cấu viên chức theo chức danh nghề nghiệp được thực hiện theo quy định tại khoản 5",
            "points": []
          }
        ]
      },
      {
        "article": "Điều 3",
        "title": ", khoản 3",
        "clauses": []
      },
      {
        "article": "Điều 4",
        "title": "Nghị định số 106/2020/NĐ-CP ngày 10 tháng 9 năm",
        "clauses": [
          {
            "no": "1",
            "text": "2020 của Chính phủ về vị trí việc làm và số lượng người làm việc trong đơn vị sự nghiệp công lập.",
            "points": []
          }
        ]
      },
      {
        "article": "Điều 7",
        "title": "Điều",
        "clauses": [
          {
            "no": "1",
            "text": "khoản chuyển tiếp Đối với viên chức hiện đang giữ ngạch công chức hoặc hạng chức danh nghề nghiệp viên chức cao hơn so với hạng chức danh nghề nghiệp viên chức theo yêu cầu của vị trí việc làm được quy định tại Thông tư này trước ngày Thông tư này có hiệu lực thì tiếp tục được giữ ngạch công chức hoặc hạng chức danh nghề nghiệp và bậc lương hiện giữ cho đến khi có hướng dẫn mới về chế độ tiền lương theo quy định.",
            "points": []
          }
        ]
      },
      {
        "article": "Điều 8",
        "title": "Hiệu",
        "clauses": [
          {
            "no": "1",
            "text": "lực thi hành 1. Thông tư này có hiệu lực thi hành kể từ ngày 01 tháng 3 năm 2023. 2. Trường hợp các văn bản quy phạm pháp luật dẫn chiếu tại Thông tư này được sửa đổi, bổ sung hoặc thay thế thì thực hiện theo quy định tại các văn bản sửa đổi, bổ sung, thay thế đó.",
            "points": []
          }
        ]
      },
      {
        "article": "Điều 9",
        "title": "Tổ",
        "clauses": [
          {
            "no": "1",
            "text": "chức thực hiện Chánh Văn phòng Bộ, Chánh Thanh tra Bộ, các Vụ trưởng, Thủ trưởng các cơ quan, đơn vị và tổ chức, cá nhân có liên quan chịu trách nhiệm thi hành Thông tư này./. Nơi nhận: - Văn phòng Chính phủ; - Các Bộ, cơ quan ngang Bộ; - Ủy ban nhân dân các tỉnh, thành phố trực thuộc Trung ương; - Bộ trưởng Bộ G",
            "points": []
          }
        ]
      }
    ],
    "validation": {
      "status": "warning",
      "issues": [
        "Low content preservation: 69.92%"
      ],
      "stats": {
        "original_length": 4930,
        "segmented_length": 3447,
        "preservation_ratio": 0.6991886409736309,
        "total_articles": 13,
        "total_clauses": 12,
        "total_points": 0
      }
    },
    "document_type": "decree"
  }
}