{
  "doc_id": "441_2002_QĐ_BTM",
  "meta": {
    "url": "https://thuvienphapluat.vn/van-ban/Bo-may-hanh-chinh/Quyet-dinh-0441-2002-QD-BTM-su-dung-co-hieu-quan-ly-thi-truong-dung-phuong-tien-giao-thong-cho-hang-lau-tai-thi-xa-huyen-bien-gioi-49785.aspx",
    "crawl_time": "2025-10-15T12:27:29.386673",
    "number": "441/2002/QĐ-BTM",
    "field": "Giao thông",
    "issue_date": "16/04/2002",
    "agency": "BỘ TRƯỞNG BỘ THƯƠNG MẠI SỐ 0441/2002/QĐ-BTM NGÀY 16",
    "content": "BỘ\r\n  THƯƠNG MẠI ******** CỘNG\r\n  HOÀ XÃ HỘI CHỦ NGHĨA VIỆT NAM Độc lập - Tự do - Hạnh phúc ******** Số:\r\n  441/2002/QĐ-BTM Hà\r\n  Nội, ngày 16 tháng 4 năm 2002 QUYẾT ĐỊNH CỦA BỘ TRƯỞNG BỘ THƯƠNG MẠI SỐ 0441/2002/QĐ-BTM NGÀY 16\r\nTHÁNG 04 NĂM 2002 BAN HÀNH QUY ĐỊNH VỀ SỬ DỤNG CỜ HIỆU QUẢN LÝ THỊ TRƯỜNG DỪNG\r\nPHƯƠNG TIỆN GIAO THÔNG CHỞ HÀNG LẬU TẠI THỊ XÃ, HUYỆN BIÊN GIỚI BỘ TRƯỞNG BỘ THƯƠNG MẠI Căn cứ Pháp lệnh xử lý vi phạm\r\nhành chính ngày 6/7/1995; Căn cứ Nghị định số 95/CP ngày 4/12/1993 về chức năng, nhiệm vụ quyền hạn và\r\ntổ chức bộ máy của Bộ Thương mại; Căn cứ Nghị định số 10/CP ngày 23/01/1995 của Chính phủ về tổ chức, nhiệm vụ,\r\nquyền hạn của Quản lý thị trường; Căn cứ Văn bản số 308/VPCP-VI ngày 17/01/2002 của Văn phòng Chính phủ thông\r\nbáo ý kiến của Thủ tướng Chính phủ cho phép Đội trưởng Đội Quản lý thị trường\r\nđược dùng cờ hiệu Quản lý thị trường dừng phương tiện giao thông chở hàng lậu tại\r\nthị xã, huyện biên giới; Theo đề nghị của Cục trưởng Cục Quản lý thị trường. QUYẾT ĐỊNH Điều 1. Ban hành kèm theo Quyết định này \"Quy định về sử dụng\r\ncờ hiệu Quản lý thị trường dừng phương tiện giao thông chở hàng lậu tại thị xã,\r\nhuyện biên giới\". Điều 2. Giao cho Cục trưởng Cục Quản lý thị trường chỉ đạo, hướng\r\ndẫn đôn đốc, kiểm tra việc thi hành Quy định này. Điều 3. \"Quy định về sử dụng cờ hiệu Quản lý thị trường dừng\r\nphương tiện giao thông chở hàng lậu\" có hiệu lực thi hành sau 15 ngày kể từ\r\nngày ký. Điều 4. Chánh Văn phòng Bộ, Vụ trưởng Vụ Pháp chế, Cục trưởng Cục\r\nQuản lý thị trường; Giám đốc Sở Thương mại (Sở Thương mại - Du lịch), Chi cục\r\ntrưởng Chi cục Quản lý thị trường các tỉnh, thành phố trực thuộc Trung ương chịu\r\ntrách nhiệm thi hành Quyết định này. Vũ\r\n  Khoan (Đã\r\n  ký) QUY ĐỊNH VỀ SỬ DỤNG CỜ HIỆU QUẢN LÝ THỊ TRƯỜNG DỪNG\r\nPHƯƠNG TIỆN GIAO THÔNG CHỞ HÀNG LẬU TẠI THỊ XÃ, HUYỆN BIÊN GIỚI (Ban hành kèm theo Quyết định số 0441/2002/QĐ-BTM ngày 16 tháng 04 năm 2002\r\ncủa Bộ trưởng Bộ Thương mại) I. QUY ĐỊNH\r\nCHUNG Điều 1. Quy định này áp dụng đối với Đội trưởng Đội Quản lý thị\r\ntrường khi được phân công làm nhiệm vụ tại các thị xã, huyện ở khu vực biên giới\r\ncủa các tỉnh có đường biên giới quốc gia giáp với các nước láng giềng: Quảng\r\nNinh, Cao Bằng, Lạng Sơn, Hà Giang, Lào Cai, Lai Châu, Hà Tĩnh, Quảng Trị, Tây\r\nNinh, Long An, An Giang, Đồng Tháp, Kiên Giang. Trong phạm vi những địa bàn\r\ntrên, ở nơi nào lực lượng Quản lý thị trường đã phối hợp có hiệu quả với lực lượng\r\nCảnh sát giao thông trong việc dừng phương tiện để kiểm tra hàng lậu thì tiếp tục\r\nduy trì và phát huy sự phối hợp đó. Điều 2. Ngoài các địa bàn quy định tại Điều 1 của Quy định này,\r\nviệc dừng các phương tiện giao thông chở hàng lậu thực hiện theo Điểm 4 Chỉ thị số 21/1998CT-TTg ngày\r\n24-4-1998 của Thủ tướng Chính phủ: \"Lực lượng Quản lý thị trường, Thuế vụ,\r\nHải quan khi phát hiện phương tiện giao thông có chở hàng lậu thì trực tiếp\r\nliên hệ với Cảnh sát giao thông đang làm nhiệm vụ nơi gần nhất để Cảnh sát giao\r\nthông dừng phương tiện cho các lực lượng đó kiểm tra, kiểm soát và phải chịu\r\nhoàn toàn trách nhiệm trước pháp luật về yêu cầu dừng phương tiện giao\r\nthông\". Điều 3. Nghiêm cấm việc lợi dụng cờ hiệu Quản lý thị trường để\r\ndừng phương tiện giao thông trái các quy định. Trường hợp vi phạm, tuỳ theo mức\r\nđộ sai phạm, mà bị xử lý kỷ luật hành chính hoặc truy cứu trách nhiệm hình sự\r\nvà bồi thường thiệt hại về vật chất (nếu có) theo quy định của pháp luật. Điều 4. Trách nhiệm và nghĩa vụ của người điều khiển phương tiện\r\nhoặc chủ hàng: 1 . Chấp hành nghiêm chỉnh\r\nhiệu lệnh dừng phương tiện của Đội trưởng Đội Quản lý thị trường và chịu sự kiểm\r\ntra, kiểm soát đối với hàng hoá chở trên phương tiện. 2. Xuất trình các hoá đơn và chứng\r\ntừ có liên quan đến nguồn gốc của hàng hoá trên phương tiện. 3. Khiếu nại và tố cáo với\r\ncơ quan Nhà nước có thẩm quyền về các hành vi vi phạm pháp luật của Đội trưởng,\r\nKiểm soát viên thị trường khi thi hành công vụ. II. TRÌNH TỰ, THỦ TỤC DỪNG PHƯƠNG TIỆN GIAO THÔNG, KIỂM TRA, KIỂM\r\nSOÁT HÀNG LẬU Điều 5. Việc dừng phương tiện giao thông để kiểm tra, kiểm soát\r\nhàng lậu phải triệt để tuân thủ các quy định trong pháp lệnh xử lý vi phạm hành\r\nchính. Điều 6. Đội trưởng (hoặc Phó Đội trưởng được ủy quyền bằng văn bản\r\nkhi Đội trưởng đi vắng) chỉ được dừng phương tiện giao thông để kiểm tra khi có\r\ncăn cứ để nhận định rằng trong phương tiện đó có chở hàng 1ậu qua các nguồn tin\r\nbáo của cơ sở hoặc thông qua điều tra, xác minh. Căn cứ \"Phiếu đề xuất dừng\r\nphương tiện chở hàng lậu\" (theo mẫu đính kèm Quy định này), Đội trưởng (hoặc\r\nPhó Đội trưởng được ủy quyền) xem xét, ra Quyết định kiểm tra và chịu trách nhiệm\r\ntrước pháp luật về quyết định của mình. Điều 7. Khi làm nhiệm vụ, Đội trưởng Đội Quản lý thị tường phải\r\nchấp hành các quy đinh sau: 1. Phải chấp hành đầy đủ\r\nQuy chế công tác quản lý thị trường ban hành kèm theo Quyết định số 1243/2000/QĐ-BTM ngày 6/9/2000 của Bộ trưởng Bộ Thương mại. 2. Đội trưởng (hoặc Phó Đội trưởng\r\nđược uỷ quyền) phụ trách Tổ công tác phải đeo băng công tác trên tay t"
  },
  "structure": {
    "articles": [
      {
        "article": "Điều 1",
        "title": "Ban hành kèm theo Quyết định này \"Quy định về sử dụng",
        "clauses": [
          {
            "no": "1",
            "text": "cờ hiệu Quản lý thị trường dừng phương tiện giao thông chở hàng lậu tại thị xã, huyện biên giới\".",
            "points": []
          }
        ]
      },
      {
        "article": "Điều 2",
        "title": "Giao cho Cục trưởng Cục Quản lý thị trường chỉ đạo, hướng",
        "clauses": [
          {
            "no": "1",
            "text": "dẫn đôn đốc, kiểm tra việc thi hành Quy định này.",
            "points": []
          }
        ]
      },
      {
        "article": "Điều 3",
        "title": "\"Quy định về sử dụng cờ hiệu Quản lý thị trường dừng",
        "clauses": [
          {
            "no": "1",
            "text": "phương tiện giao thông chở hàng lậu\" có hiệu lực thi hành sau 15 ngày kể từ ngày ký.",
            "points": []
          }
        ]
      },
      {
        "article": "Điều 4",
        "title": "Chánh Văn phòng Bộ, Vụ trưởng Vụ Pháp chế, Cục trưởng Cục",
        "clauses": [
          {
            "no": "1",
            "text": "Quản lý thị trường; Giám đốc Sở Thương mại (Sở Thương mại - Du lịch), Chi cục trưởng Chi cục Quản lý thị trường các tỉnh, thành phố trực thuộc Trung ương chịu trách nhiệm thi hành Quyết định này. Vũ Khoan (Đã ký) QUY ĐỊNH VỀ SỬ DỤNG CỜ HIỆU QUẢN LÝ THỊ TRƯỜNG DỪNG PHƯƠNG TIỆN GIAO THÔNG CHỞ HÀNG LẬU TẠI THỊ XÃ, HUYỆN BIÊN GIỚI (Ban hành kèm theo Quyết định số 0441/2002/QĐ-BTM ngày 16 tháng 04 năm 2002 của Bộ trưởng Bộ Thương mại) I. QUY ĐỊNH CHUNG",
            "points": []
          }
        ]
      },
      {
        "article": "Điều 1",
        "title": "Quy định này áp dụng đối với Đội trưởng Đội Quản lý thị",
        "clauses": [
          {
            "no": "1",
            "text": "trường khi được phân công làm nhiệm vụ tại các thị xã, huyện ở khu vực biên giới của các tỉnh có đường biên giới quốc gia giáp với các nước láng giềng: Quảng Ninh, Cao Bằng, Lạng Sơn, Hà Giang, Lào Cai, Lai Châu, Hà Tĩnh, Quảng Trị, Tây Ninh, Long An, An Giang, Đồng Tháp, Kiên Giang. Trong phạm vi những địa bàn trên, ở nơi nào lực lượng Quản lý thị trường đã phối hợp có hiệu quả với lực lượng Cảnh sát giao thông trong việc dừng phương tiện để kiểm tra hàng lậu thì tiếp tục duy trì và phát huy sự phối hợp đó.",
            "points": []
          }
        ]
      },
      {
        "article": "Điều 2",
        "title": "Ngoài các địa bàn quy định tại",
        "clauses": []
      },
      {
        "article": "Điều 1",
        "title": "của Quy định này,",
        "clauses": [
          {
            "no": "1",
            "text": "việc dừng các phương tiện giao thông chở hàng lậu thực hiện theo Điểm 4 Chỉ thị số 21/1998CT-TTg ngày 24-4-1998 của Thủ tướng Chính phủ: \"Lực lượng Quản lý thị trường, Thuế vụ, Hải quan khi phát hiện phương tiện giao thông có chở hàng lậu thì trực tiếp liên hệ với Cảnh sát giao thông đang làm nhiệm vụ nơi gần nhất để Cảnh sát giao thông dừng phương tiện cho các lực lượng đó kiểm tra, kiểm soát và phải chịu hoàn toàn trách nhiệm trước pháp luật về yêu cầu dừng phương tiện giao thông\".",
            "points": []
          }
        ]
      },
      {
        "article": "Điều 3",
        "title": "Nghiêm cấm việc lợi dụng cờ hiệu Quản lý thị trường để",
        "clauses": [
          {
            "no": "1",
            "text": "dừng phương tiện giao thông trái các quy định. Trường hợp vi phạm, tuỳ theo mức độ sai phạm, mà bị xử lý kỷ luật hành chính hoặc truy cứu trách nhiệm hình sự và bồi thường thiệt hại về vật chất (nếu có) theo quy định của pháp luật.",
            "points": []
          }
        ]
      },
      {
        "article": "Điều 4",
        "title": "Trách nhiệm và nghĩa vụ của người điều khiển phương tiện",
        "clauses": [
          {
            "no": "1",
            "text": "hoặc chủ hàng: 1 . Chấp hành nghiêm chỉnh hiệu lệnh dừng phương tiện của Đội trưởng Đội Quản lý thị trường và chịu sự kiểm tra, kiểm soát đối với hàng hoá chở trên phương tiện. 2. Xuất trình các hoá đơn và chứng từ có liên quan đến nguồn gốc của hàng hoá trên phương tiện. 3. Khiếu nại và tố cáo với cơ quan Nhà nước có thẩm quyền về các hành vi vi phạm pháp luật của Đội trưởng, Kiểm soát viên thị trường khi thi hành công vụ. II. TRÌNH TỰ, THỦ TỤC DỪNG PHƯƠNG TIỆN GIAO THÔNG, KIỂM TRA, KIỂM SOÁT HÀNG LẬU",
            "points": []
          }
        ]
      },
      {
        "article": "Điều 5",
        "title": "Việc dừng phương tiện giao thông để kiểm tra, kiểm soát",
        "clauses": [
          {
            "no": "1",
            "text": "hàng lậu phải triệt để tuân thủ các quy định trong pháp lệnh xử lý vi phạm hành chính.",
            "points": []
          }
        ]
      },
      {
        "article": "Điều 6",
        "title": "Đội trưởng (hoặc Phó Đội trưởng được ủy quyền bằng văn bản",
        "clauses": [
          {
            "no": "1",
            "text": "khi Đội trưởng đi vắng) chỉ được dừng phương tiện giao thông để kiểm tra khi có căn cứ để nhận định rằng trong phương tiện đó có chở hàng 1ậu qua các nguồn tin báo của cơ sở hoặc thông qua điều tra, xác minh. Căn cứ \"Phiếu đề xuất dừng phương tiện chở hàng lậu\" (theo mẫu đính kèm Quy định này), Đội trưởng (hoặc Phó Đội trưởng được ủy quyền) xem xét, ra Quyết định kiểm tra và chịu trách nhiệm trước pháp luật về quyết định của mình.",
            "points": []
          }
        ]
      },
      {
        "article": "Điều 7",
        "title": "Khi làm nhiệm vụ, Đội trưởng Đội Quản lý thị tường phải",
        "clauses": [
          {
            "no": "1",
            "text": "chấp hành các quy đinh sau: 1. Phải chấp hành đầy đủ Quy chế công tác quản lý thị trường ban hành kèm theo Quyết định số 1243/2000/QĐ-BTM ngày 6/9/2000 của Bộ trưởng Bộ Thương mại. 2. Đội trưởng (hoặc Phó Đội trưởng được uỷ quyền) phụ trách Tổ công tác phải đeo băng công tác trên tay t",
            "points": []
          }
        ]
      }
    ],
    "validation": {
      "status": "warning",
      "issues": [
        "Low content preservation: 65.38%"
      ],
      "stats": {
        "original_length": 4934,
        "segmented_length": 3226,
        "preservation_ratio": 0.6538305634373733,
        "total_articles": 12,
        "total_clauses": 11,
        "total_points": 0
      }
    },
    "document_type": "decree"
  }
}