{
  "doc_id": "46_2024_TT_BCA",
  "meta": {
    "url": "https://thuvienphapluat.vn/van-ban/Giao-thong-Van-tai/Thong-tu-46-2024-TT-BCA-sua-doi-Thong-tu-67-2019-TT-BCA-thuc-hien-dan-chu-an-toan-giao-thong-626393.aspx",
    "crawl_time": "2025-10-15T10:56:31.849718",
    "number": "46/2024/TT-BCA",
    "field": "Giao thông",
    "issue_date": "30/09/2024",
    "agency": "BỘ TRƯỞNG BỘ CÔNG AN QUY ĐỊNH VỀ THỰC HIỆN DÂN CHỦ TRONG CÔNG TÁC BẢO",
    "content": "BỘ\r\n  CÔNG AN ------- CỘNG\r\n  HÒA XÃ HỘI CHỦ NGHĨA VIỆT NAM Độc lập - Tự do - Hạnh phúc --------------- Số: 46/2024/TT-BCA Hà Nội, ngày 30\r\n  tháng 9 năm 2024 THÔNG TƯ SỬA\r\nĐỔI, BỔ SUNG MỘT SỐ ĐIỀU CỦA THÔNG TƯ SỐ 67/2019/TT-BCA NGÀY 28 THÁNG 11 NĂM\r\n2019 CỦA BỘ TRƯỞNG BỘ CÔNG AN QUY ĐỊNH VỀ THỰC HIỆN DÂN CHỦ TRONG CÔNG TÁC BẢO\r\nĐẢM TRẬT TỰ, AN TOÀN GIAO THÔNG Căn cứ Luật Tiếp cận\r\nthông tin ngày 06 tháng 4 năm 2016; Căn cứ Luật Công\r\nan nhân dân ngày 20 tháng 11 năm 2018; Luật sửa\r\nđổi, bổ sung một số điều của Luật Công an nhân dân ngày 22 tháng 6 năm\r\n2023; Căn cứ Luật Thực\r\nhiện dân chủ ở cơ sở ngày 10 tháng 11 năm 2022; Căn cứ Nghị định số 01/2018/NĐ-CP ngày 06 tháng\r\n8 năm 2018 của Chính phủ quy định chức năng, nhiệm vụ, quyền hạn và cơ cấu tổ\r\nchức của Bộ Công an; Theo đề nghị của Cục trưởng Cục Cảnh sát giao\r\nthông; Bộ trưởng Bộ Công an ban hành Thông tư sửa đổi,\r\nbổ sung một số điều của Thông tư số 67/2019/TT-BCA ngày 28 tháng 11 năm 2019 quy định về thực hiện dân chủ trong công tác bảo đảm\r\ntrật tự, an toàn giao thông. Điều 1. Sửa đổi, bổ sung một số\r\nđiều của Thông tư số 67/2019/TT-BCA ngày 28 tháng 11 năm 2019 của Bộ trưởng Bộ\r\nCông an quy định về thực hiện dân chủ trong công tác bảo đảm trật tự, an toàn\r\ngiao thông 1. Sửa đổi, bổ sung khoản 2, khoản 3\r\nĐiều 4 như sau: a) Sửa đổi, bổ sung khoản 2 Điều 4 như sau: “2. Khu vực thực thi công vụ là nơi được giới hạn bằng\r\ncọc tiêu hình chóp nón hoặc dây căng để cán bộ, chiến sĩ thực thi nhiệm vụ bảo\r\nđảm trật tự, an toàn giao thông và an ninh, trật tự. Khu vực thực thi công vụ\r\nphải tuân thủ các quy định pháp luật khác có liên quan.”. b) Sửa đổi, bổ sung khoản 3 Điều 4 như sau: “3. Dây căng là dây có nền màu đỏ, viền màu vàng,\r\nchiều rộng từ 5cm đến 10cm; trên dây có in dòng chữ “HÀNG RÀO CẢNH SÁT. CẤM\r\nVƯỢT QUA - POLICE LINE. DO NOT CROSS” màu vàng có phản quang.”. 2. Sửa đổi, bổ sung điểm b, điểm c\r\nkhoản 1, điểm b, điểm d khoản 2 và bổ sung điểm d vào sau điểm\r\nc khoản 4 Điều 5 như sau: a) Sửa đổi, bổ sung điểm b khoản 1 Điều 5 như sau: “b) Tên, địa chỉ, số điện thoại trực ban, hòm thư\r\ngóp ý, tài khoản mạng xã hội, thời gian tiếp công dân giải quyết xử lý vi phạm\r\nhành chính của cơ quan Công an có nhiệm vụ tuần tra, kiểm soát và xử lý vi phạm\r\nhành chính;”. b) Sửa đổi, bổ sung điểm c khoản 1 Điều 5 như sau: “c) Các phương tiện, thiết bị kỹ thuật nghiệp vụ\r\ndùng để phát hiện vi phạm hành chính theo quy định của Luật Xử lý vi phạm hành chính ;”. c) Sửa đổi, bổ sung điểm b khoản 2 Điều 5 như sau: “b) Tên, địa chỉ, thời gian làm việc, số điện thoại\r\ntrực ban, hòm thư góp ý, tài khoản mạng xã hội của cơ quan Công an có nhiệm vụ\r\nđăng ký, cấp biển số xe;”. d) Sửa đổi, bổ sung điểm d khoản 2 Điều 5 như sau: “d) Biển số đưa ra đấu giá, lệ phí đăng ký xe;”. đ) Bổ sung điểm d vào sau điểm c khoản 4 Điều 5 như sau: “d) Tên, địa chỉ, số điện thoại trực ban, hòm thư\r\ngóp ý, tài khoản mạng xã hội của cơ quan Công an có nhiệm vụ điều tra, giải quyết\r\ntai nạn giao thông.”. 3. Sửa đổi, bổ sung khoản 1 Điều 6 như sau: “1. Đăng tải trên Cổng Thông tin điện tử; Trang\r\nthông tin điện tử, tài khoản mạng xã hội của cơ quan Công an.”. 4. Sửa đổi, bổ sung khoản 3 Điều 8 như sau: “3. Thông qua Cổng Thông tin điện tử; Trang thông\r\ntin điện tử; tài khoản mạng xã hội và các phần mềm ứng dụng trên thiết bị điện\r\ntử do cơ quan Công an lập và quản lý.”. 5. Sửa đổi, bổ sung khoản 5 Điều 9 như sau: “5. Thông báo cho cơ quan Công an hoặc Ủy ban nhân\r\ndân nơi gần nhất các vụ tai nạn, ùn tắc giao thông; các vụ đua xe trái phép,\r\ngây rối trật tự công cộng, vi phạm pháp luật hình sự làm ảnh hưởng an toàn giao\r\nthông; đặt chướng ngại vật trên đường gây cản trở giao thông; ném đất, đá hoặc\r\ncác vật khác vào phương tiện hoặc người tham gia giao thông; vận chuyển trái\r\nphép chất cháy, chất nổ, chất ma túy hoặc vận chuyển trái phép các hàng hóa\r\nkhác; các hành vi giả danh Công an nhân dân; chống người thi hành công vụ và\r\ncác hành vi vi phạm trật tự, an toàn giao thông khác.”. 6. Sửa đổi, bổ sung Điều 11 như sau: “Điều 11. Hình thức giám sát của Nhân dân 1. Nhân dân được giám sát thông qua các hình thức\r\nsau: a) Tiếp cận thông tin công khai của lực lượng Công\r\nan và trên các phương tiện thông tin đại chúng; b) Qua các chủ thể giám sát theo quy định của pháp luật; c) Tiếp xúc, giải quyết trực tiếp công việc với cán\r\nbộ, chiến sĩ; d) Kết quả giải quyết các vụ việc, đơn thư, khiếu nại,\r\ntố cáo, kiến nghị, phản ánh; đ) Quan sát trực tiếp công tác bảo đảm trật tự, an\r\ntoàn giao thông. 2. Việc giám sát của Nhân dân phải đảm bảo các điều\r\nkiện sau: a) Không làm ảnh hưởng đến hoạt động của cán bộ,\r\nchiến sĩ khi đang thực thi công vụ; b) Không được vào khu vực thực thi công vụ quy định\r\ntại khoản 2 Điều 4 Thông tư này, trừ người có quyền và\r\nnghĩa vụ liên quan; c) Tuân thủ các quy định pháp luật khác có liên\r\nquan.”. Điều 2. Bãi bỏ một số quy định\r\ncủa Thông tư số 67/2019/TT-BCA ngày 28 tháng 11 năm 2019 của Bộ trưởng Bộ Công\r\nan quy định về thực hiện dân chủ trong công tác bảo đảm trật tự, an toàn "
  },
  "structure": {
    "articles": [
      {
        "article": "Điều 1",
        "title": "Sửa đổi, bổ sung một số",
        "clauses": [
          {
            "no": "1",
            "text": "điều của Thông tư số 67/2019/TT-BCA ngày 28 tháng 11 năm 2019 của Bộ trưởng Bộ Công an quy định về thực hiện dân chủ trong công tác bảo đảm trật tự, an toàn giao thông 1. Sửa đổi, bổ sung khoản 2, khoản 3",
            "points": []
          }
        ]
      },
      {
        "article": "Điều 4",
        "title": "như sau: a) Sửa đổi, bổ sung khoản 2",
        "clauses": []
      },
      {
        "article": "Điều 4",
        "title": "như sau: “2. Khu vực thực thi công vụ là nơi được giới hạn bằng",
        "clauses": [
          {
            "no": "1",
            "text": "cọc tiêu hình chóp nón hoặc dây căng để cán bộ, chiến sĩ thực thi nhiệm vụ bảo đảm trật tự, an toàn giao thông và an ninh, trật tự. Khu vực thực thi công vụ phải tuân thủ các quy định pháp luật khác có liên quan.”. b) Sửa đổi, bổ sung khoản 3",
            "points": []
          }
        ]
      },
      {
        "article": "Điều 4",
        "title": "như sau: “3. Dây căng là dây có nền màu đỏ, viền màu vàng,",
        "clauses": [
          {
            "no": "1",
            "text": "chiều rộng từ 5cm đến 10cm; trên dây có in dòng chữ “HÀNG RÀO CẢNH SÁT. CẤM VƯỢT QUA - POLICE LINE. DO NOT CROSS” màu vàng có phản quang.”. 2. Sửa đổi, bổ sung điểm b, điểm c khoản 1, điểm b, điểm d khoản 2 và bổ sung điểm d vào sau điểm c khoản 4",
            "points": []
          }
        ]
      },
      {
        "article": "Điều 5",
        "title": "như sau: a) Sửa đổi, bổ sung điểm b khoản 1",
        "clauses": []
      },
      {
        "article": "Điều 5",
        "title": "như sau: “b) Tên, địa chỉ, số điện thoại trực ban, hòm thư",
        "clauses": [
          {
            "no": "1",
            "text": "góp ý, tài khoản mạng xã hội, thời gian tiếp công dân giải quyết xử lý vi phạm hành chính của cơ quan Công an có nhiệm vụ tuần tra, kiểm soát và xử lý vi phạm hành chính;”. b) Sửa đổi, bổ sung điểm c khoản 1",
            "points": []
          }
        ]
      },
      {
        "article": "Điều 5",
        "title": "như sau: “c) Các phương tiện, thiết bị kỹ thuật nghiệp vụ",
        "clauses": [
          {
            "no": "1",
            "text": "dùng để phát hiện vi phạm hành chính theo quy định của Luật Xử lý vi phạm hành chính ;”. c) Sửa đổi, bổ sung điểm b khoản 2",
            "points": []
          }
        ]
      },
      {
        "article": "Điều 5",
        "title": "như sau: “b) Tên, địa chỉ, thời gian làm việc, số điện thoại",
        "clauses": [
          {
            "no": "1",
            "text": "trực ban, hòm thư góp ý, tài khoản mạng xã hội của cơ quan Công an có nhiệm vụ đăng ký, cấp biển số xe;”. d) Sửa đổi, bổ sung điểm d khoản 2",
            "points": []
          }
        ]
      },
      {
        "article": "Điều 5",
        "title": "như sau: “d) Biển số đưa ra đấu giá, lệ phí đăng ký xe;”. đ) Bổ sung điểm d vào sau điểm c khoản 4",
        "clauses": []
      },
      {
        "article": "Điều 5",
        "title": "như sau: “d) Tên, địa chỉ, số điện thoại trực ban, hòm thư",
        "clauses": [
          {
            "no": "1",
            "text": "góp ý, tài khoản mạng xã hội của cơ quan Công an có nhiệm vụ điều tra, giải quyết tai nạn giao thông.”. 3. Sửa đổi, bổ sung khoản 1",
            "points": []
          }
        ]
      },
      {
        "article": "Điều 6",
        "title": "như sau: “1. Đăng tải trên Cổng Thông tin điện tử; Trang",
        "clauses": [
          {
            "no": "1",
            "text": "thông tin điện tử, tài khoản mạng xã hội của cơ quan Công an.”. 4. Sửa đổi, bổ sung khoản 3",
            "points": []
          }
        ]
      },
      {
        "article": "Điều 8",
        "title": "như sau: “3. Thông qua Cổng Thông tin điện tử; Trang thông",
        "clauses": [
          {
            "no": "1",
            "text": "tin điện tử; tài khoản mạng xã hội và các phần mềm ứng dụng trên thiết bị điện tử do cơ quan Công an lập và quản lý.”. 5. Sửa đổi, bổ sung khoản 5",
            "points": []
          }
        ]
      },
      {
        "article": "Điều 9",
        "title": "như sau: “5. Thông báo cho cơ quan Công an hoặc Ủy ban nhân",
        "clauses": [
          {
            "no": "1",
            "text": "dân nơi gần nhất các vụ tai nạn, ùn tắc giao thông; các vụ đua xe trái phép, gây rối trật tự công cộng, vi phạm pháp luật hình sự làm ảnh hưởng an toàn giao thông; đặt chướng ngại vật trên đường gây cản trở giao thông; ném đất, đá hoặc các vật khác vào phương tiện hoặc người tham gia giao thông; vận chuyển trái phép chất cháy, chất nổ, chất ma túy hoặc vận chuyển trái phép các hàng hóa khác; các hành vi giả danh Công an nhân dân; chống người thi hành công vụ và các hành vi vi phạm trật tự, an toàn giao thông khác.”. 6. Sửa đổi, bổ sung",
            "points": []
          }
        ]
      },
      {
        "article": "Điều 11",
        "title": "như sau: “",
        "clauses": []
      },
      {
        "article": "Điều 11",
        "title": "Hình thức giám sát của Nhân dân 1. Nhân dân được giám sát thông qua các hình thức",
        "clauses": [
          {
            "no": "1",
            "text": "sau: a) Tiếp cận thông tin công khai của lực lượng Công an và trên các phương tiện thông tin đại chúng; b) Qua các chủ thể giám sát theo quy định của pháp luật; c) Tiếp xúc, giải quyết trực tiếp công việc với cán bộ, chiến sĩ; d) Kết quả giải quyết các vụ việc, đơn thư, khiếu nại, tố cáo, kiến nghị, phản ánh; đ) Quan sát trực tiếp công tác bảo đảm trật tự, an toàn giao thông. 2. Việc giám sát của Nhân dân phải đảm bảo các điều kiện sau: a) Không làm ảnh hưởng đến hoạt động của cán bộ, chiến sĩ khi đang thực thi công vụ; b) Không được vào khu vực thực thi công vụ quy định tại khoản 2",
            "points": []
          }
        ]
      },
      {
        "article": "Điều 4",
        "title": "Thông tư này, trừ người có quyền và",
        "clauses": [
          {
            "no": "1",
            "text": "nghĩa vụ liên quan; c) Tuân thủ các quy định pháp luật khác có liên quan.”.",
            "points": []
          }
        ]
      },
      {
        "article": "Điều 2",
        "title": "Bãi bỏ một số quy định",
        "clauses": [
          {
            "no": "1",
            "text": "của Thông tư số 67/2019/TT-BCA ngày 28 tháng 11 năm 2019 của Bộ trưởng Bộ Công an quy định về thực hiện dân chủ trong công tác bảo đảm trật tự, an toàn",
            "points": []
          }
        ]
      }
    ],
    "strategy_used": "dieu",
    "validation": {
      "status": "warning",
      "issues": [
        "Low content preservation: 58.45%"
      ],
      "stats": {
        "original_length": 4939,
        "segmented_length": 2887,
        "preservation_ratio": 0.5845312816359587,
        "total_articles": 17,
        "total_clauses": 13,
        "total_points": 0
      }
    },
    "document_type": "law"
  }
}