{
  "doc_id": "46_2024_QĐ_UBND",
  "meta": {
    "url": "https://thuvienphapluat.vn/van-ban/Tai-chinh-nha-nuoc/Quyet-dinh-46-2024-QD-UBND-tham-quyen-xu-ly-tai-san-ket-cau-ha-tang-giao-thong-duong-bo-Son-La-630450.aspx",
    "crawl_time": "2025-10-15T14:01:33.239695",
    "number": "46/2024/QĐ-UBND",
    "field": "Giao thông",
    "issue_date": "05/11/2024",
    "agency": "ỦY BAN NHÂN DÂN TỈNH SƠN LA",
    "content": "ỦY BAN NHÂN DÂN TỈNH SƠN LA ------- CỘNG HÒA XÃ HỘI\r\n  CHỦ NGHĨA VIỆT NAM Độc lập - Tự do - Hạnh phúc --------------- Số:\r\n  46/2024/QĐ-UBND Sơn La, ngày 05\r\n  tháng 11 năm 2024 QUYẾT ĐỊNH VỀ VIỆC QUY ĐỊNH\r\nTHẨM QUYỀN QUYẾT ĐỊNH XỬ LÝ TÀI SẢN KẾT CẤU HẠ TẦNG GIAO THÔNG ĐƯỜNG BỘ THUỘC\r\nĐỊA PHƯƠNG QUẢN LÝ ỦY BAN NHÂN DÂN TỈNH SƠN LA Căn cứ Luật Tổ chức chính quyền địa phương ngày\r\n19 tháng 6 năm 2015; Luật Sửa đổi, bổ sung một số điều của Luật Tổ chức Chính\r\nphủ và Luật Tổ chức chính quyền địa phương ngày 22 tháng 11 năm 2019; Căn cứ Luật Ban hành văn bản quy phạm pháp luật\r\nngày 22 tháng 6 năm 2015; Luật Sửa đổi, bổ sung một số điều của Luật ban hành\r\nvăn bản quy phạm pháp luật sửa đổi ngày 28 tháng 6 năm 2020; Căn cứ Nghị định số 34/2014/NĐ-CP ngày 14 tháng\r\n5 năm 2024 của Chính phủ quy định chi tiết một số điều và biện pháp thi hành\r\nLuật ban hành văn bản quy phạm pháp luật; Căn cứ Nghị định số 154/2020/NĐ-CP ngày 31 tháng\r\n12 năm 2020 của Chính phủ về sửa đổi, bổ sung một số điều của Nghị định số 34/2016/NĐ-CP ngày 14 tháng 5 năm 2016 của Chính phủ quy định chi tiết một số\r\nđiều và biện pháp thi hành Luật Ban hành văn bản quy phạm pháp luật; Căn cứ Nghị định số 59/2024/NĐ-CP ngày 25 tháng\r\n5 năm 2024 của Chính phủ sửa đổi, bổ sung một số điều của Nghị định số 34/2016/NĐ-CP ngày 14 tháng 5 năm 2016 của Chính phủ quy định chi tiết một số\r\nđiều và biện pháp thi hành Luật Ban hành văn bản quy phạm pháp luật đã được sửa\r\nđổi, bổ sung một số điều theo Nghị định số 154/2020/NĐ-CP ngày 31 tháng 12 năm\r\n2020 của Chính phủ; Căn cứ Nghị định số 44/2024/NĐ-CP ngày 24 tháng\r\n4 năm 2024 của Chính phủ quy định việc quản lý, sử dụng và khai thác tài sản\r\nkết cấu hạ tầng giao thông đường bộ. Theo đề nghị của Giám đốc Sở Tài chính tại Tờ\r\ntrình số 297/TTr-STC ngày 27 tháng 9 năm 2024. QUYẾT ĐỊNH Điều 1. Phạm vi điều chỉnh, đối tượng áp dụng 1. Phạm vi điều chỉnh: Quyết định này quy\r\nđịnh thẩm quyền quyết định xử lý tài sản kết cấu hạ tầng giao thông đường bộ\r\nthuộc địa phương quản lý theo quy định tại điểm c khoản 2 Điều 21; điểm d khoản\r\n2 Điều 22; điểm c khoản 2 Điều 23; điểm b khoản 2 Điều 24; điểm b khoản 2 Điều\r\n25 Nghị định số 44/2024/NĐ-CP ngày 24 tháng 4 năm 2024 của Chính phủ quy định\r\nviệc quản lý, sử dụng và khai thác tài sản kết cấu hạ tầng giao thông đường bộ. 2. Đối tượng áp dụng: Quy định chi tiết tại\r\nĐiều 2 Nghị định số 44/2024/NĐ-CP ngày 24 tháng 4 năm 2024 của Chính phủ quy\r\nđịnh việc quản lý, sử dụng và khai thác tài sản kết cấu hạ tầng giao thông\r\nđường bộ. Điều 2. Thẩm quyền quyết định xử lý tài sản\r\nkết cấu hạ tầng giao thông đường bộ. 1. Thu hồi tài sản kết cấu hạ tầng giao\r\nthông đường bộ ( Quy định tại điểm c khoản 2 Điều 21 Nghị định số 44/2024/NĐ-CP ngày 24 tháng 4 năm 2024 của Chính phủ ). - UBND tỉnh quyết định thu hồi tài sản kết cấu hạ\r\ntầng giao thông đường bộ thuộc phạm vi quản lý của các Sở, ngành, đơn vị cấp\r\ntỉnh quản lý. - UBND cấp huyện quyết định thu hồi tài sản kết cấu\r\nhạ tầng giao thông đường bộ thuộc phạm vi quản lý của UBND cấp huyện và UBND\r\ncấp xã trực thuộc. 2. Điều chuyển tài sản kết cấu hạ tầng giao\r\nthông đường bộ (Quy định tại điểm d khoản 2 Điều 22 Nghị định số 44/2024/NĐ-CP ngày 24 tháng 4 năm 2024 của Chính phủ ). - UBND tỉnh quyết định điều chuyển tài sản kết cấu\r\nhạ tầng giao thông đường bộ giữa các Sở, ngành, đơn vị cấp tỉnh quản lý; giữa\r\nđơn vị quản lý cấp tỉnh với UBND cấp huyện và giữa UBND cấp huyện với nhau trên\r\nđịa bàn tỉnh. - UBND cấp huyện quyết định điều chuyển tài sản kết\r\ncấu hạ tầng giao thông đường bộ giữa các cơ quan, tổ chức, đơn vị thuộc phạm vi\r\nquản lý của UBND cấp huyện và UBND cấp xã trực thuộc. 3. Chuyển giao tài sản kết cấu hạ tầng giao\r\nthông đường bộ về địa phương quản lý, xử lý ( Quy định tại điểm c khoản 2\r\nĐiều 23 Nghị định số 44/2024/NĐ-CP ngày 24 tháng 4 năm 2024 của Chính phủ ). UBND tỉnh quyết định chuyển giao tài sản kết cấu hạ\r\ntầng giao thông đường bộ trên địa bàn tỉnh cho các cơ quan chức năng của địa\r\nphương (Cơ quan chuyên môn thuộc Ủy ban nhân dân cấp tỉnh, Trung tâm Phát triển\r\nquỹ đất, cơ quan chuyên môn thuộc UBND cấp huyện) quản lý, xử lý. 4. Thanh lý tài sản kết cấu hạ tầng giao\r\nthông đường bộ (Quy định tại điểm b khoản 2 Điều 24 Nghị định số 44/2024/NĐ-CP ngày 24 tháng 4 năm 2024 của Chính phủ ) - UBND tỉnh quyết định thanh lý tài sản kết cấu hạ\r\ntầng giao thông đường bộ thuộc phạm vi quản lý của các Sở, ngành, đơn vị cấp\r\ntỉnh quản lý. - UBND cấp huyện quyết định thanh lý tài sản kết\r\ncấu hạ tầng giao thông đường bộ thuộc phạm vi quản lý của UBND cấp huyện và\r\nUBND cấp xã trực thuộc. 5. Xử lý tài sản kết cấu hạ tầng giao thông\r\nđường bộ trong trường hợp bị mất, bị hủy hoại ( Quy định tại điểm b khoản 2\r\nĐiều 25 Nghị định số 44/2024/NĐ-CP ngày 24 tháng 4 năm 2024 của Chính phủ ) - UBND tỉnh quyết định xử lý tài sản kết cấu hạ\r\ntầng giao thông đường bộ trong trường hợp bị mất, bị hủy hoại thuộc phạm vi\r\nquản lý của các Sở, ngành, đơn vị cấp tỉnh quản lý. - UBND cấp huyện quyết định xử lý tài sản kết cấu\r\nhạ tầng giao thô"
  },
  "structure": {
    "articles": [
      {
        "article": "Điều 1",
        "title": "Phạm vi điều chỉnh, đối tượng áp dụng 1. Phạm vi điều chỉnh: Quyết định này quy",
        "clauses": [
          {
            "no": "1",
            "text": "định thẩm quyền quyết định xử lý tài sản kết cấu hạ tầng giao thông đường bộ thuộc địa phương quản lý theo quy định tại điểm c khoản 2",
            "points": []
          }
        ]
      },
      {
        "article": "Điều 21",
        "title": "; điểm d khoản",
        "clauses": [
          {
            "no": "1",
            "text": "2",
            "points": []
          }
        ]
      },
      {
        "article": "Điều 22",
        "title": "; điểm c khoản 2",
        "clauses": []
      },
      {
        "article": "Điều 23",
        "title": "; điểm b khoản 2",
        "clauses": []
      },
      {
        "article": "Điều 24",
        "title": "; điểm b khoản 2",
        "clauses": []
      },
      {
        "article": "Điều 25",
        "title": "Nghị định số 44/2024/NĐ-CP ngày 24 tháng 4 năm 2024 của Chính phủ quy định",
        "clauses": [
          {
            "no": "1",
            "text": "việc quản lý, sử dụng và khai thác tài sản kết cấu hạ tầng giao thông đường bộ. 2. Đối tượng áp dụng: Quy định chi tiết tại",
            "points": []
          }
        ]
      },
      {
        "article": "Điều 2",
        "title": "Nghị định số 44/2024/NĐ-CP ngày 24 tháng 4 năm 2024 của Chính phủ quy",
        "clauses": [
          {
            "no": "1",
            "text": "định việc quản lý, sử dụng và khai thác tài sản kết cấu hạ tầng giao thông đường bộ.",
            "points": []
          }
        ]
      },
      {
        "article": "Điều 2",
        "title": "Thẩm quyền quyết định xử lý tài sản",
        "clauses": [
          {
            "no": "1",
            "text": "kết cấu hạ tầng giao thông đường bộ. 1. Thu hồi tài sản kết cấu hạ tầng giao thông đường bộ ( Quy định tại điểm c khoản 2",
            "points": []
          }
        ]
      },
      {
        "article": "Điều 21",
        "title": "Nghị định số 44/2024/NĐ-CP ngày 24 tháng 4 năm 2024 của Chính phủ ). - UBND tỉnh quyết định thu hồi tài sản kết cấu hạ",
        "clauses": [
          {
            "no": "1",
            "text": "tầng giao thông đường bộ thuộc phạm vi quản lý của các Sở, ngành, đơn vị cấp tỉnh quản lý. - UBND cấp huyện quyết định thu hồi tài sản kết cấu hạ tầng giao thông đường bộ thuộc phạm vi quản lý của UBND cấp huyện và UBND cấp xã trực thuộc. 2. Điều chuyển tài sản kết cấu hạ tầng giao thông đường bộ (Quy định tại điểm d khoản 2",
            "points": []
          }
        ]
      },
      {
        "article": "Điều 22",
        "title": "Nghị định số 44/2024/NĐ-CP ngày 24 tháng 4 năm 2024 của Chính phủ ). - UBND tỉnh quyết định điều chuyển tài sản kết cấu",
        "clauses": [
          {
            "no": "1",
            "text": "hạ tầng giao thông đường bộ giữa các Sở, ngành, đơn vị cấp tỉnh quản lý; giữa đơn vị quản lý cấp tỉnh với UBND cấp huyện và giữa UBND cấp huyện với nhau trên địa bàn tỉnh. - UBND cấp huyện quyết định điều chuyển tài sản kết cấu hạ tầng giao thông đường bộ giữa các cơ quan, tổ chức, đơn vị thuộc phạm vi quản lý của UBND cấp huyện và UBND cấp xã trực thuộc. 3. Chuyển giao tài sản kết cấu hạ tầng giao thông đường bộ về địa phương quản lý, xử lý ( Quy định tại điểm c khoản 2",
            "points": []
          }
        ]
      },
      {
        "article": "Điều 23",
        "title": "Nghị định số 44/2024/NĐ-CP ngày 24 tháng 4 năm 2024 của Chính phủ ). UBND tỉnh quyết định chuyển giao tài sản kết cấu hạ",
        "clauses": [
          {
            "no": "1",
            "text": "tầng giao thông đường bộ trên địa bàn tỉnh cho các cơ quan chức năng của địa phương (Cơ quan chuyên môn thuộc Ủy ban nhân dân cấp tỉnh, Trung tâm Phát triển quỹ đất, cơ quan chuyên môn thuộc UBND cấp huyện) quản lý, xử lý. 4. Thanh lý tài sản kết cấu hạ tầng giao thông đường bộ (Quy định tại điểm b khoản 2",
            "points": []
          }
        ]
      },
      {
        "article": "Điều 24",
        "title": "Nghị định số 44/2024/NĐ-CP ngày 24 tháng 4 năm 2024 của Chính phủ ) - UBND tỉnh quyết định thanh lý tài sản kết cấu hạ",
        "clauses": [
          {
            "no": "1",
            "text": "tầng giao thông đường bộ thuộc phạm vi quản lý của các Sở, ngành, đơn vị cấp tỉnh quản lý. - UBND cấp huyện quyết định thanh lý tài sản kết cấu hạ tầng giao thông đường bộ thuộc phạm vi quản lý của UBND cấp huyện và UBND cấp xã trực thuộc. 5. Xử lý tài sản kết cấu hạ tầng giao thông đường bộ trong trường hợp bị mất, bị hủy hoại ( Quy định tại điểm b khoản 2",
            "points": []
          }
        ]
      },
      {
        "article": "Điều 25",
        "title": "Nghị định số 44/2024/NĐ-CP ngày 24 tháng 4 năm 2024 của Chính phủ ) - UBND tỉnh quyết định xử lý tài sản kết cấu hạ",
        "clauses": [
          {
            "no": "1",
            "text": "tầng giao thông đường bộ trong trường hợp bị mất, bị hủy hoại thuộc phạm vi quản lý của các Sở, ngành, đơn vị cấp tỉnh quản lý. - UBND cấp huyện quyết định xử lý tài sản kết cấu hạ tầng giao thô",
            "points": []
          }
        ]
      }
    ],
    "strategy_used": "dieu",
    "validation": {
      "status": "warning",
      "issues": [
        "Low content preservation: 42.98%"
      ],
      "stats": {
        "original_length": 4942,
        "segmented_length": 2124,
        "preservation_ratio": 0.42978551193848646,
        "total_articles": 13,
        "total_clauses": 10,
        "total_points": 0
      }
    },
    "document_type": "law"
  }
}