{
  "doc_id": "738_QĐ_BGTVT",
  "meta": {
    "url": "https://thuvienphapluat.vn/van-ban/Bo-may-hanh-chinh/Quyet-dinh-738-QD-BGTVT-2024-sua-doi-Quyet-dinh-1246-QD-BGTVT-Khu-Quan-ly-duong-bo-II-614440.aspx",
    "crawl_time": "2025-10-15T13:54:01.048033",
    "number": "738/QĐ-BGTVT",
    "field": "Giao thông",
    "issue_date": "17/06/2024",
    "agency": "BỘ GIAO THÔNG VẬN",
    "content": "BỘ GIAO THÔNG VẬN\r\n  TẢI ------- CỘNG HÒA XÃ HỘI\r\n  CHỦ NGHĨA VIỆT NAM Độc lập - Tự do - Hạnh phúc --------------- Số: 738/QĐ-BGTVT Hà Nội, ngày 17\r\n  tháng 6 năm 2024 QUYẾT ĐỊNH VỀ VIỆC SỬA ĐỔI MỘT SỐ ĐIỀU CỦA QUYẾT ĐỊNH SỐ 1246/QĐ-BGTVT NGÀY 28/9/2022 CỦA BỘ TRƯỞNG BỘ GIAO THÔNG VẬN TẢI QUY ĐỊNH CHỨC NĂNG, NHIỆM VỤ,\r\nQUYỀN HẠN VÀ CƠ CẤU TỔ CHỨC CỦA KHU QUẢN LÝ ĐƯỜNG BỘ II TRỰC THUỘC CỤC ĐƯỜNG BỘ\r\nVIỆT NAM BỘ TRƯỞNG BỘ GIAO THÔNG VẬN TẢI Căn cứ Nghị định số 56/2022/NĐ-CP ngày 24/8/2022 của Chính phủ quy định\r\nchức năng, nhiệm vụ, quyền hạn và cơ cấu tổ chức của Bộ Giao thông vận tải; Căn cứ Nghị định số 123/2016/NĐ-CP ngày 01/9/2016 của Chính phủ quy\r\nđịnh chức năng, nhiệm vụ, quyền hạn và cơ cấu tổ chức của các bộ, cơ quan ngang\r\nbộ; Nghị định số 101/2020/NĐ-CP ngày\r\n28/8/2020 của Chính phủ sửa đổi, bổ sung một số điều của Nghị định số 123/2016/NĐ-CP ; Căn cứ Nghị định số 03/2024/NĐ-CP ngày 11/01/2024 của Chính phủ quy\r\nđịnh về cơ quan thực hiện chức năng thanh tra chuyên ngành và hoạt động của cơ\r\nquan được giao thực hiện chức năng thanh tra chuyên ngành; Căn cứ Kết luận số\r\n93-KL/BCSĐ ngày 24/5/2024 của Ban Cán sự đảng Bộ Giao thông vận tải về công tác\r\ntổ chức, cán bộ; Xét đề nghị của Cục trưởng Cục\r\nĐường bộ Việt Nam tại Tờ trình số 73/TTr-CĐBVN ngày 07/6/2024; Theo đề nghị của Vụ trưởng Vụ\r\nTổ chức cán bộ. QUYẾT ĐỊNH: Điều 1. Sửa đổi một số điều của Quyết định số 1246/QĐ-BGTVT ngày 28/9/2022 của Bộ trưởng\r\nBộ Giao thông vận tải quy định chức năng, nhiệm vụ, quyền hạn và cơ cấu tổ chức\r\ncủa Khu Quản lý đường bộ II trực thuộc Cục Đường bộ Việt Nam: 1. Sửa đổi khoản 10 Điều 2 như sau: “Tiếp công dân, giải quyết\r\nkhiếu nại, tố cáo, phòng, chống tham nhũng theo quy định của pháp luật.”. 2. Sửa đổi khoản 3, khoản 4 Điều 3 như sau: “3. Phòng Quản lý, bảo trì\r\nđường bộ. 4. Phòng Quản lý, tổ chức\r\ngiao thông đường bộ.”. 3. Sửa đổi khoản 2 Điều 5 như sau: “2. Trung tâm Kỹ thuật đường\r\nbộ 2 tiếp tục duy trì hoạt động theo quy định hiện hành cho đến khi cơ quan có\r\nthẩm quyền hoàn thành việc sắp xếp đối với đơn vị này.”. Điều 2. Quyết định này có hiệu lực kể từ ngày ký. Chánh Văn phòng Bộ, Chánh Thanh\r\ntra Bộ, các Vụ trưởng, Cục trưởng Cục Đường bộ Việt Nam và Thủ trưởng các cơ\r\nquan, đơn vị có liên quan chịu trách nhiệm thi hành Quyết định này./. Nơi nhận: - Như Điều 2; - Bộ Nội vụ; - Các Thứ trưởng Bộ GTVT; - UBND các tỉnh, thành phố trực thuộc Trung ương; - Các cơ quan, đơn vị trực thuộc Bộ GTVT; - Sở GTVT các tỉnh, thành phố: Thanh Hóa, Nghệ An, Hà Tĩnh, Quảng Bình, Quảng\r\n  Trị, Thừa Thiên Huế; - Cổng thông tin điện tử Bộ GTVT; - Lưu: VT, TCCB (TA). BỘ TRƯỞNG Nguyễn Văn Thắng"
  },
  "structure": {
    "articles": [
      {
        "article": "Điều 1",
        "title": "Sửa đổi một số điều của Quyết định số 1246/QĐ-BGTVT ngày 28/9/2022 của Bộ trưởng",
        "clauses": [
          {
            "no": "1",
            "text": "Bộ Giao thông vận tải quy định chức năng, nhiệm vụ, quyền hạn và cơ cấu tổ chức của Khu Quản lý đường bộ II trực thuộc Cục Đường bộ Việt Nam: 1. Sửa đổi khoản 10",
            "points": []
          }
        ]
      },
      {
        "article": "Điều 2",
        "title": "như sau: “Tiếp công dân, giải quyết",
        "clauses": [
          {
            "no": "1",
            "text": "khiếu nại, tố cáo, phòng, chống tham nhũng theo quy định của pháp luật.”. 2. Sửa đổi khoản 3, khoản 4",
            "points": []
          }
        ]
      },
      {
        "article": "Điều 3",
        "title": "như sau: “3. Phòng Quản lý, bảo trì",
        "clauses": [
          {
            "no": "1",
            "text": "đường bộ. 4. Phòng Quản lý, tổ chức giao thông đường bộ.”. 3. Sửa đổi khoản 2",
            "points": []
          }
        ]
      },
      {
        "article": "Điều 5",
        "title": "như sau: “2. Trung tâm Kỹ thuật đường",
        "clauses": [
          {
            "no": "1",
            "text": "bộ 2 tiếp tục duy trì hoạt động theo quy định hiện hành cho đến khi cơ quan có thẩm quyền hoàn thành việc sắp xếp đối với đơn vị này.”.",
            "points": []
          }
        ]
      },
      {
        "article": "Điều 2",
        "title": "Quyết định này có hiệu lực kể từ ngày ký. Chánh Văn phòng Bộ, Chánh Thanh",
        "clauses": [
          {
            "no": "1",
            "text": "tra Bộ, các Vụ trưởng, Cục trưởng Cục Đường bộ Việt Nam và Thủ trưởng các cơ quan, đơn vị có liên quan chịu trách nhiệm thi hành Quyết định này./. Nơi nhận: - Như",
            "points": []
          }
        ]
      },
      {
        "article": "Điều 2",
        "title": "; - Bộ Nội vụ; - Các Thứ trưởng Bộ GTVT; - UBND các tỉnh, thành phố trực thuộc Trung ương; - Các cơ quan, đơn vị trực thuộc Bộ GTVT; - Sở GTVT các tỉnh, thành phố: Thanh Hóa, Nghệ An, Hà Tĩnh, Quảng Bình, Quảng",
        "clauses": [
          {
            "no": "1",
            "text": "Trị, Thừa Thiên Huế; - Cổng thông tin điện tử Bộ GTVT; - Lưu: VT, TCCB (TA). BỘ TRƯỞNG Nguyễn Văn Thắng",
            "points": []
          }
        ]
      }
    ],
    "validation": {
      "status": "warning",
      "issues": [
        "Low content preservation: 28.50%"
      ],
      "stats": {
        "original_length": 2593,
        "segmented_length": 739,
        "preservation_ratio": 0.28499807173158503,
        "total_articles": 6,
        "total_clauses": 6,
        "total_points": 0
      }
    },
    "document_type": "decree"
  }
}